文章類別編號,文章類別,文章標題,文章內容,文章來源編號,日期,文章網址,文字雲,關係圖,文章摘要
11,中港澳 財經 經濟,台灣文旦柚恢復輸陸！等待2年中秋節前解禁，柚農嘆宣布時間太晚了,中秋節前夕傳來佳音，等待2年時間，台灣輸往大陸的柑橘類水果文旦柚確定解禁！中國國台辦今（2）日宣布，花蓮縣方面提供部分業者整改資料，多方綜合評估相關整改措施，基於符合大陸相關檢驗檢疫規定，中國海關總署決定自9月2日起恢復台灣文旦柚輸入大陸。中國國台辦發言人陳斌華指出，因多次從台灣輸大陸柑橘類水果中檢出檢疫性有害生物等不合格情況，基於保障生物安全和大陸消費者健康的考慮，海關總署自2022年8月3日起暫停了台灣柑橘類水果（包括文旦柚）輸入。陳斌華表示，一段時間以來，國民黨中央政策會執行長傅崐萁等人士及台灣花蓮縣等方面多次向強烈願望，並組織業者進行整改，改善產品品質，確保輸往大陸文旦柚安全。陳斌華稱，近期，花蓮縣方面提供了部分業者整改資料。在綜合評估相關整改措施、符合大陸相關檢驗檢疫規定的基礎上，海關總署決定自9月2日起恢復台灣文旦柚輸入，輸大陸文旦柚須來自獲得註冊登記的包裝廠和果園。（相關報導：中國省市多恢復國道收費，因應地方財政危機　專家：電動車發展造成燃油稅大減｜更多文章）最後陳斌華強調，只要堅持「九二共識」、反對「台獨」，兩岸就是一家人，一家人的事情就好商量、好解決。陸方願秉持「兩岸一家親」理念，與台灣相關方面商談台灣農產品輸入大陸的事項，為台灣同胞特別是基層民眾謀利造福。但有文旦柚農直言，陸方現在才宣布輸入實在太晚了，大部分的文旦之前就採收完且已經賣掉，更何況今年因天氣乾旱關係，產量沒有這麼多，其實作業時間滿緊湊，因此可能「遠水救不了近火」。,2,2024-09-02,https://www.storm.mg/article/5231815,https://d1pxdrw6gckt4w.cloudfront.net/wordcloud/ee98336a-04d5-4f43-aab0-36b7529f3391,https://d1pxdrw6gckt4w.cloudfront.net/network/74eb837c-4051-4782-90e5-b1662c471edc,中秋節前夕，台灣文旦柚確定恢復輸往中國大陸，結束了2年的禁令。中國國台辦宣布，經過花蓮縣業者整改並符合大陸檢疫規定，海關總署從9月2日起恢復進口。禁令源自2022年8月3日，因台灣輸入的柑橘類水果多次檢出有害生物。國民黨政策會執行長傅崐萁及花蓮縣方面多次推動整改，最終獲得解禁。陳斌華強調，只要堅持「九二共識」和反對「台獨」，大陸願意與台灣商談農產品輸入事宜。然而，文旦柚農表示，解禁時間太晚，大部分文旦已採收並售出，加上今年乾旱影響產量，實際效益有限。
1,風生活 品味生活 汽車 消費,【集體評比】70～90萬小型掀背車戰力分析 都會小精靈 Suzuki Swift X Mazda 2 X Skoda Fabia X Honda Fit X Kia Picanto (上),儘管大小休旅車在國內市場當道，但小型掀背車在擁有可愛古錐或個性時尚的造型，以及能在都會市區中靈活穿梭與方便停車的靈巧身形等優勢條件下，仍舊受到不少年輕消費族群的青睞與喜愛，依舊在國內市場上保有相當不錯且穩定的銷售表現。因此藉著此次全新大改款Suzuki Swift的推出上市，特別為各位端上70～90萬級距掀背小車的產品介紹與分析，包括經改款上市的Mazda 2、Skoda Fabia以及以油耗制霸的Honda Fit e:HEV等車型，當然預計在今年10月引進上市的二度小改款Kia Picanto我們也沒放過，讓有興趣選購上列掀背小車的買家們，精挑細選與仔細比較，去選出一部最喜愛且最適合自己需求的車款。Suzuki Swift新車售價 73萬元✓     Level.2主動安全科技入列✘     引擎怠速抖動略為明顯Mazda 2新車售價 78.9萬元✓     更為個性動感的外型與精緻內裝✘     缺少ACC跟車與車道維持系統Skoda Fabia新車售價   84.8～96.8萬元✓       實用的配備空間、精緻的駕乘感受✘       少了些刁鑽靈動的小車特色Honda Fit新車售價   75.9～82.9萬元✓       出色乘適性、26.9km/L平均油耗(e:HEV)✘       ACC非全速域設定Kia Picanto新車售價   預估65～70萬元✓       霸氣運動的外型、主動安全配備升級✘      內裝鋪陳改款變動幅度略小 ●Swift 1.2L/73萬元●長/寬/高3860/1735/1480mm、軸距2450mm（相關報導：【改裝實戰】六字大明紅黑閃電號 (上) 個性化風格完美展現｜更多文章）●1.2升 82hp/11.0kgm、平均油耗24.5 km/L對於專精小車研發的Suzuki來說，Swift不僅是當家主力銷售車款，亦是該品牌的精神指標，更是都會靈活時尚小車的最佳代言者。而全新第四代大改款Swift於今年7月中旬正式發表上市，採單一動力規格與販售車型設定，新車售價73萬元，與舊款價格相較僅有微幅調漲，且新車不僅擁有全新的內外造型設計之外，在配備與安全科技部分皆有所升級強化，尤其換上新的1.2升3缸引擎，平均油耗更提升至24.5km/L，因此在車輛各方面實力皆精進之下，搭配此親民的售價，產品CP值可說相當高。,2,2024-09-02,https://www.storm.mg/lifestyle/5230859,https://d1pxdrw6gckt4w.cloudfront.net/wordcloud/5ecc49eb-f7e5-4cee-8c1c-33f564028e20,https://d1pxdrw6gckt4w.cloudfront.net/network/1aea910b-ec3e-43cb-8409-30520de783ba,這篇文章對比分析了五款在70至90萬元區間的小型掀背車，包括全新大改款的Suzuki Swift、Mazda 2、Skoda Fabia、Honda Fit e:HEV和預計在今年10月上市的Kia Picanto。文章指出，儘管大小休旅車在市場上占主導地位，小型掀背車憑藉其靈巧的車身和可愛時尚的外觀仍受到年輕消費者的青睞。文章詳細介紹了每款車的售價、優點和缺點，例如Suzuki Swift的靈活性和高CP值、Mazda 2的動感外型和內裝、Skoda Fabia的實用配備、Honda Fit的優秀油耗表現，以及Kia Picanto的運動外型和主動安全升級。這些信息有助於消費者在選購掀背小車時進行精挑細選，找到最適合自己需求的車款。
1,風生活 國內  新竹 時事話題,新竹縣幼兒園爆「不只1位老師虐童」！把小孩當壽司捲、困廁所　黑歷史遭起底「連2年都出事」,新竹縣幼兒園驚傳虐童！新竹縣一所頗有名氣的非營利幼兒園遭爆多名老師涉及不當對待幼童，包括將孩子關在黑暗廁所、用棉被捆綁、推拉小孩等手段，甚至被部分家長懷疑園方提供的監視器畫面經過剪輯，未還原虐童真相。離譜的是，該幼兒園過去也曾因虐童事件遭罰款，但在新團隊接手後，仍聘回涉嫌虐童的教職員，引發家長強烈不滿紛紛報警求助，全案仍待調查釐清。根據《鏡週刊》報導，幼童林林（花名）的家長先前發現，孩子身上經常出現不明傷痕，因此便向園方要求查看監視器。不料，家長在看了監視器畫面後，才發現平日和藹可親的A老師竟趁著幼幼班孩子午睡期間，以不當方式對待不想睡覺的幼童！A老師先是以「捲壽司」的方式，用棉被裹著林林，讓林林只露出一顆頭，再將其拉到監視器死角處，A老師接著便坐到椅子上，一邊用雙腳夾著林林，一邊滑手機，完全不顧林林的掙扎。不僅如此，A老師後來又把捲成一條的林林扛到廁所，將其關在沒開燈的廁所內，更不顧林林的大哭求救，又回頭把本來半開的廁所門關上。報導指出，整所幼兒園不只有A老師一名不當對待幼童的教職員，另一名幼童強強（化名）的家長透露，他前陣子接到幼兒園電話通知稱教育局接獲申訴，發現強強也被不當對待，因此請家長隔天前去幼兒園查看監視器。強強家長一開始接到來電後，還先透過電子聯絡簿詢問小凱的老師B相關細節，但當時對方只表示「是在跟孩子玩推人遊戲」。不料，強強家長隔天查看監視器後，才發現所謂的「推人遊戲」，是B老師以雙手穿過強強的腋下將其扛起，再要求強強盤腿坐下，隨後就用力推其額頭、拉手臂，來回至少3、4次。而且除了強強，畫面中還見另一名小孩也遭如此對待，但2名小孩充斥著驚恐表情，顯見並非「遊戲」。不只B老師，強強在正值炎熱的夏天6月，也被另一名C老師以3、4條棉被捲起，當強強掙扎脫困時，C老師竟以「沒有，你沒有很熱，你是很冷，老師才幫你蓋棉被」為由繼續「困著」強強，隨後還拿起拖鞋在強強耳朵旁狂拍地板。（相關報導：新竹3歲男童被打到「腦出血昏迷」！媽逃家暴父「新歡也虐童」　監察院批縣府：消極處理｜更多文章）除了強強、林林家長先後透過監視器畫面發現孩子受虐，還有多位家長陸續接到教育局通知後，才知道自己孩子被不當對待，更透過社工簡訊得知該幼兒園的老師還有各式各樣的虐童方式，包括把孩子綁在椅子、用棉被捆住孩子、對孩子踢頭或用力壓頭及大力拉扯、拉扯圍兜拖拉小孩等。,2,2024-09-02,https://www.storm.mg/lifestyle/5231814,https://d1pxdrw6gckt4w.cloudfront.net/wordcloud/933b548b-b96a-43d9-9dc3-a4b94f5d7246,https://d1pxdrw6gckt4w.cloudfront.net/network/a2b122f3-b0ba-413c-9594-0da80b9e75ed,新竹縣一所非營利幼兒園驚傳多名老師虐待幼童事件，引發家長強烈不滿並報警求助。根據《鏡週刊》報導，多名家長在查看監視器畫面後，發現老師以各種不當手段對待孩子，包括將幼童裹成「壽司捲」關在黑暗廁所、用力推拉、棉被捆綁等。家長懷疑監視器畫面經過剪輯，未能還原真相。該幼兒園過去也曾因虐童事件遭罰，但在新團隊接手後，仍聘回涉嫌虐童的教職員。家長們在得知孩子受虐事實後，紛紛向教育局投訴，並透過社工簡訊了解到更多虐童手段。教育局已介入調查，案件仍在釐清中。
1,風生活 品味生活 市場動態 汽車 消費,【改裝實戰】六字大明紅黑閃電號 (上) 個性化風格完美展現,車輛/羽帝說起Honda Civic EG車系，從最末批製造的1994年至今，已有30年的時間，然而時間對這部車來說，就像淬鍊精華的鍛錘一樣，只會讓它愈發經典與珍貴，時至今日仍有許多玩家持續擁有，並且打造出更種不同風格的改裝車，就像這部全車歷時4年以上時間改造，充滿個人化風格的一部絕美EG一樣。Civic EG車系也就是國人所熟知的K6，目前在許多車聚場合時，還是會看到多部很美、很新的的EG，不過就如同引言所說，該車最少也有30年以上的車齡，以筆者曾經擁有過兩部EG車系，一部是台規手排、一部美規+B18C的經驗來看，Civic EG雖然外型好看，車況穩定好養好改，不過由於台灣氣候高溫潮濕，車台銹蝕問題一定避免不了，即使是美規車台一樣「照銹不誤」，尤其是所以如果大家想樣入手一部EG來整理的話，最好要有心理準備，可以要準備個20～30萬元來整理，才能有一個上檯面的基本樣貌。接著回來看這次採訪的這部EG改裝車，這部車筆者大約4年前就曾在車聚現場看到過，當時的樣貌與現在當然差很多，不過在車主–花輪的細心整理與改造下，慢慢集大成而有了如今讓人眼睛為之一亮的絕美身形。從外觀上來看，車頭前保桿已經更換為美國C-west改裝品，雖然氣壩同樣為一大兩小的原廠開口設計，不過在前保桿下緣適度向前延伸的情況下，開口的深度也變得更深也更加立體，搭配更下方的手工前下擾流、手工水箱罩凹痕與客製化前定風翼後，整組前保桿的侵略氣息就更加濃厚了。（相關報導：有如神助 BMW M5 Touring｜更多文章）車尾部分，可以看到後擋風玻璃的上下緣，都分別裝上翼板面積不小的上下尾翼，且上尾翼還是由spoon加長版尾翼+2023 HRV RS版本尾翼等兩組尾翼組合而成，並且適度上翹，呈現出極具張力的視覺效果。後保桿的線條同樣複雜，中央兩側已挖空，出現類似零四加速賽車才有的樣貌，並且將中央挖空加上牌照框，下方則加裝一組擴散器造型的手工後下擾流，搭配左右兩側外擴的定風翼，有著十足美式改裝車的感覺。,2,2024-09-02,https://www.storm.mg/lifestyle/5230741,https://d1pxdrw6gckt4w.cloudfront.net/wordcloud/a75abb7a-5227-4c2c-a381-89b67194bf33,https://d1pxdrw6gckt4w.cloudfront.net/network/8a93209b-869d-4d98-99d5-8894c0e57b00,這篇文章介紹了一輛經過4年以上時間改造的Honda Civic EG車系改裝車，展示了其獨特的個人化風格。Civic EG，即國人熟悉的K6，儘管已有30年的車齡，但依然受到玩家的喜愛。不過，由於台灣的高溫潮濕氣候，車台銹蝕問題不可避免，因此想要入手並整理一部EG可能需要20～30萬元的預算。文章詳細描述了這輛改裝車的外觀變化，前保桿更換為美國C-west改裝品，並加裝了手工前下擾流、水箱罩凹痕和客製化前定風翼，使其侵略氣息更濃厚。車尾部分則裝上了上下兩組尾翼，並進行了複雜的後保桿改造，呈現出零四加速賽車的樣貌，整體風格充滿美式改裝車的感覺。這部車在車主花輪的細心改造下，展現出令人驚艷的視覺效果。
11,國際,以色列尋獲6名人質遺體，部隊抵達前慘遭殺害　數十萬人抗議政府談判拖延,以色列國防軍昨天在加薩隧道尋獲6人質遺體，引發強烈悲憤，數十萬以國民眾上街抗議，譴責總理尼坦雅胡（Benjamin Netanyahu）拖延人質談判。以色列總工會也宣布今天全國性大罷工，以施壓政府儘快達成協議。以色列國防軍昨天上午表示，從加薩南部拉法市（Rafah）地下的隧道找出6名人質的屍體。他們很可能在以色列國防軍到達前不久被哈瑪斯（Hamas）屠殺。這些屍體的發現地點距離上週才獲救的人質阿爾卡迪 （Kaid Farhan al-Alkadi）的地點僅1公里。其中23歲的高德柏格－波林（Hersh Goldberg-Polin），擁有美國籍，出生於美國加州，7歲時跟父母移民到以色列。他是去年10月7日參加諾瓦音樂節（Nova Music Festival）被哈瑪斯份子綁架。他的父母8月21日才在美國民主黨全國代表大會（Democratic National Convention）中受邀發言，訴求各界支持，希望早日能讓他們的兒子和其他人質獲釋。尋獲6具人質屍體的消息傳出後，人質家屬與以色列民眾的悲憤情緒沸騰，馬上就有民眾開始動員，直到傍晚已有數十萬人聚集在特拉維夫大規模抗議。抗議活動從耶路撒冷蔓延到特拉維夫。有些人抬著蓋著國旗的棺材在特拉維夫的街道上遊行。據「人質及失蹤家庭論壇」（Hostages and Missing Families Forum）稱，昨天約有30萬人在特拉維夫進行大規模抗議，要求在更多人質被哈瑪斯殺害之前立即達成人質協議。另昨天稍早，該論壇呼籲公眾「參加大規模示威，要求徹底關閉國家」，並呼籲強大的以色列總工會發起大規模罷工。經過人質家屬代表與以色列總工會（Histadrut）協商後，昨天下午總工會會長巴大維 （Arnon Bar-David）宣布，將從今天早上6點開始舉行全面罷工，機場將從上午8點起關閉。巴大維表示，鑑於人們對哈瑪斯殺害6名俘虜的憤怒日益高漲，「達成協議比其他任何事情都重要」。此次行動是以色列總工會自去年10月7日以來首次涉足政治，目前計劃為1日罷工，之後的決定將稍後再討論。對於全面性罷工的行動，屬於極右派陣營且反對停火協議的財政部長史莫崔赫（Bezalel Smotrich）嚴厲批評說總工會會長的抉擇是「實際上是在實現（哈瑪斯領袖）辛瓦（Yahya Sinwar） 的夢想」。同時史莫崔赫也已向以色列政府總檢察長（Legal Advisor to the Government）巴哈拉夫-米亞拉Gali Baharav-Miara）提交一項緊急申請，要求針對罷工發布禁令。表示罷工沒有法律依據，因為它的目的是不正當地影響政治人物在國家安全相關問題上的重大政策決定。史莫崔赫還表示，大規模罷工將導致包括出境航班等關閉，會產生重大經濟後果，在戰時造成不必要的經濟損失。（相關報導：牆外文摘：脫口秀在中國「復活」，卻失去了叛逆的權力｜更多文章）責任編輯／蔡娪嫣,2,2024-09-02,https://www.storm.mg/article/5231762,https://d1pxdrw6gckt4w.cloudfront.net/wordcloud/063730d3-d2c4-448a-a9a5-6543a3e42f8d,https://d1pxdrw6gckt4w.cloudfront.net/network/b193b953-4739-4626-bfa5-e9716c0bc147,        以色列國防軍在加薩隧道中尋獲6具人質遺體，引發公眾強烈憤怒和大規模抗議。數十萬民眾譴責總理尼坦雅胡拖延人質談判，要求儘快達成協議。以色列總工會宣布全國性大罷工，從今天早上6點開始，機場將從上午8點起關閉。這是以色列總工會自去年10月7日以來首次涉足政治。抗議活動從耶路撒冷蔓延至特拉維夫，大量民眾抬著蓋著國旗的棺材在街道上遊行。對此，財政部長史莫崔赫批評總工會的行動，並向政府總檢察長提交緊急申請，要求針對罷工發布禁令，認為罷工將導致重大經濟後果。
1,風生活 理財 旅遊 新知 消費 時事話題,2025年機票會降價嗎？長榮總經理分析票價走勢：1航線高機率出現便宜票,旅遊業者觀察，今（2024）年報復性出國旅遊的熱潮稍微趨緩，團體滿團的時間較2023年慢，但與COVID-19疫情前差不多。明（2025）年有可能買得到便宜機票？長榮航空總經理孫嘉明昨（1）日指出，因整體客運需求穩定，明年票價走勢依舊「易漲難跌」；降幅較有感的會在港澳線，尤其港澳需求降溫、供給顯著增加，最有機會買到便宜機票。航空業新冠大流行後迎來客運需求大反彈，桃園機場公司援引統計數據指出，2024年前7月桃園機場客運量達2604萬人次，已接近2019年疫情前水準，約91.3％，全年將可突破4000萬人次，預估2025年至2026年會恢復到疫情前水準。而長榮航空第2季本期淨利新台幣82.2億元，創歷年單季最高，每股盈餘1.44元；累計上半年合併淨利為133.8億元，為歷年同期新高，每股盈餘2.31元。展望今年後續與明年度營運，孫嘉明受訪時表示，客運需求仍穩定，但票價估計僅微幅下滑3％至4％，仍視艙等和季節性因素而定；由於油價波動，機務、機場等成本都在上漲，很難期待機票價格下修，估計整體走勢「易漲難跌」。其中以長程線最為顯著，孫嘉明說，北美線除西雅圖因短時間內多家航空公司開航，難免會競爭促銷，其他票價都算穩。至於區域航線，日本線還是很穩，加上國人喜好赴日旅遊，需求強勁，有可能因淡旺季關係出現零星促銷票價，但想期待大規模降福的機率有限。歐洲基本票價則維持不變，主要受惠需求持續暢旺，及烏克蘭戰爭導致的繞道效應等。東南亞最有機會撿到便宜票的是印尼首都雅加達，至於泰國清邁、越南峴港等觀光航點，基本上降幅皆有限。孫嘉明提及，因港澳線需求減少，不過，疫後因長榮、華航、國泰等大型航空公司相繼恢復航班，同時段有多家航空公司加入，現階段供過於求，是較容易出現便宜機票的機會，若民眾欲買性價比高的機票，港澳航線將是省錢的首選。（相關報導：機票什麼時候買最便宜？達人曝1時間點買「能搶到漂亮的價格」！5招省錢搶票秘訣揭曉｜更多文章）責任編輯／林俐,2,2024-09-02,https://www.storm.mg/lifestyle/5231757,https://d1pxdrw6gckt4w.cloudfront.net/wordcloud/6b51b15e-dcdb-4288-8b9d-67dfe7ea4493,https://d1pxdrw6gckt4w.cloudfront.net/network/fac01157-7a45-496b-a237-7229697d6134,2024年報復性出國旅遊熱潮稍緩，2025年機票價格走勢如何成為關注焦點。長榮航空總經理孫嘉明表示，由於客運需求穩定，2025年機票價格「易漲難跌」，整體降幅僅3％至4％。其中港澳航線因需求下降、供給增加，出現便宜機票的機率較高。其他航線如北美、日本、歐洲和東南亞，票價變動有限，長程航線尤其顯著。桃園機場數據顯示，2024年前7月客運量達2604萬人次，接近疫情前水準，預估2025年至2026年可完全恢復。長榮航空今年上半年業績創歷史新高，淨利達133.8億元。孫嘉明指出，油價波動及各項成本上漲，使得整體票價難以下跌，唯有港澳航線供過於求，較容易買到便宜票。
1,風生活 品味生活,台北新光三越Diamond Towers期間限定店 即日起至9月21日，誠摯邀請您前來體驗路易十三之美,當人頭馬集團創辦人Paul Emile Rémy Martin從酒窖中取出家族保存的生命之水時，其中大部分已經標示著“hors d’âge” (超越年齡) ，酒窖大師特別保存了酒窖最稀有、古老的生命之水，流傳給未來的世代並將這珍貴的遺產世代相傳。現今的酒窖大師，正在為尚未出生的未來世代創造，特別保留了珍貴的生命之水，傳承給未來的世代，稀有的干邑超越時光，創造未來。以法國國王為名，向守護干邑地區的法國國王致敬，酒瓶的設計靈感取自於文藝復興後期藝術風格。取自人頭馬Remy Martin 酒窖特別保留的最古老、最珍貴的生命之水，取自於大香檳干邑區的頂級干邑，路易十三LOUIS XIII 一直是為世界上最頂級的餐宴、最重要的時刻所保留的酒品。一滴一滴慢慢品味，精釀好酒，是時光的香氣。（相關報導：閃耀動人如明月的琥珀色佳釀 ---- 路易十三｜更多文章）適逢佳節，送上好酒讓感情醇萃 。頂級干邑「路易十三」THE DROP珍萃裝化身時尚配件：烈酒也能又潮又輕便，適用所有慶賀時分，最能夠突顯送禮人的獨特品味。尤其是有「可以喝的香水」美名的法國頂級干邑路易十三，亦是酒界的夢幻逸品，結合代代相傳的百年精萃、時尚高雅推陳出新的瓶身、跨越數百年的品牌精神，作為情義深遠的精巧禮品。除了極至奢華的酒體外，路易十三最為人所稱道的，便是那結合歷史與藝術的經典瓶身，而身處這個快速更迭的世代，品牌也不斷精益求精，推出極為時尚與潮流的設計，像是在最新推出的「THE DROP珍萃裝」中，路易十三專為年輕族群設計了皮套背帶，不論都市行旅還是郊外踏青，打高爾夫球、滑雪或登山…等等，都極富特色與巧思，處處彰顯著青春摩登的冒險精神。金、綠、紅、白、杏等鮮明優雅的瓶頭色彩，分別代表「氣場非凡Loud」、「光芒四射Glow」、「大膽 Bold」、「圓潤Smooth」、「耀眼清亮 Bright」等5種不同意象，也正好呼應東方五行的哲學概念，潮人們可隨心情變化或穿搭選擇，輕鬆兼顧創意、實用與美觀。新光三越Diamond Towers 台北市大安區忠孝東路三段268號一館1樓詳情請洽 0800 889 813週一至週四 11:00 – 21:30週五 11:00 – 22:00週六 11:00 – 22:00週日 11:00 – 21:30,2,2024-09-02,https://www.storm.mg/lifestyle/5231794,https://d1pxdrw6gckt4w.cloudfront.net/wordcloud/ef1c62e7-9a9d-4c50-a4be-5e85ef384894,https://d1pxdrw6gckt4w.cloudfront.net/network/1c9599fc-5f39-4cad-a901-94cf358aefa6,台北新光三越Diamond Towers期間限定店即日起至9月21日開放，邀請民眾前來體驗路易十三的美麗傳統。這款頂級干邑以法國國王命名，酒瓶設計靈感源自文藝復興後期的藝術風格，並使用大香檳干邑區頂級生命之水製成。路易十三以其歷史與藝術結合的經典瓶身和奢華酒體著稱，並推出「THE DROP珍萃裝」以吸引年輕族群，設計了皮套背帶，適合各種活動。瓶頭色彩代表不同意象，呼應東方五行哲學，兼顧創意、實用與美觀。限定店位於台北市大安區忠孝東路三段268號，開放時間為週一至週四11:00-21:30，週五至週六11:00-22:00，週日11:00-21:30。詳情請洽0800 889 813。
