文章類別編號,文章類別,文章標題,文章內容,文章來源編號,日期,文章網址,文字雲,關係圖,文章摘要
31,評論 國際 政治 投書,觀點投書：台灣不該繼續跟著美國瞎挺以色列,以色列國(猶太人為主；其實以色列國裡面也有阿拉伯人等多民族，但幾乎都受到歧視性待遇）已經瘋狂了，尤其是該國總理納坦雅胡，上帝說 「要使一個人滅亡；必先使其瘋狂。」，現在筆者相信世人們已經看得很清楚了。以色列國防軍可以「自行決定」是否攻擊伊朗（波斯人建立的國家），這是憑什麼？因為伊朗也想做核子武器。而以色列「摩薩德」所派出的情報特殊人員，已經暗殺許多伊朗的科學家了。但是以色列自己已經製造出核子武器了，以色列這樣做早就已經違規了，那既然以色列可以這麼做；伊朗為何不能也這麼做？現在以色列打著「消滅哈瑪斯」的大旗，對「加薩走廊」發動「無差別攻擊」，結果打了這麼久，哈瑪斯還是沒被消滅。然而導彈、飛彈、炸彈打到加薩的建築物和土地上，死傷的是當地人民，當地人民主要是巴勒斯坦人，巴勒斯坦人也是阿拉伯人的一個分支，難道以色列的猶太人不懂嗎？自己能力差，抓不到哈瑪斯，只變成對阿拉伯民族巴勒斯坦人進行種族滅絕及大屠殺，以色列人自己以前也遭受希特勒幾乎相同的待遇，現在為什麼還對巴勒斯坦人也做出希特勒「反人類罪」的行為？迦南地或以色列國不是上帝給予的「應許之地」，以色列國的土地是英、美、法硬弄出來讓猶太人建立以色列國的。若以真正的「應許之地」來說，除了現在的以色列國之外，還包括黎巴嫩、巴勒斯坦等國家，說不定甚至還包括敘利亞、埃及的一部分呢！所以以色列國常攻擊黎巴嫩等國，而這幾個國家又都是阿拉伯人建立的。現在以色列又在和黎巴嫩境內的「真主黨」作戰了，苦的又是黎巴嫩的阿拉伯人了。而美國在這場「不對稱戰爭」中的角色就是力挺以色列「自衛權」的武器、軍火供應者。美國軍火商在這場戰爭中，不曉得賺了多少錢？在這些人數著鈔票的同時；他們知道有多少巴勒斯坦難民犠牲生命嗎？不，他們毫不關心！美國將平時老掛在嘴上的「自由」、「民主」、「法治」、「人權」；全部拋諸腦後去了，尤其是「人權」這個項目！所以説，以色列和美國未免太過分了吧？！請問賴清德總統，中華民國(台灣)政府還要繼續挺美國而間接，甚至在檯面下直接挺以色列嗎？台灣人挺不下去了啦！！（相關報導：用功讀書不如投對胎！韓國教育報告說實話：升學率取決於家庭社經實力｜更多文章）＊作者為語文工作者,2,2024-09-02,https://www.storm.mg/article/5229896,https://d1pxdrw6gckt4w.cloudfront.net/wordcloud/e9948b68-e9d1-42d5-ab29-255fb54cf31a,https://d1pxdrw6gckt4w.cloudfront.net/network/4380f248-8836-4e06-9ae6-b94dbadfddbc,"
文章討論了以色列在中東地區的攻擊行為和美國對其的支持，並批評台灣政府在這一問題上的立場。作者指出，以色列針對伊朗和加薩走廊的軍事行動，尤其是在對待巴勒斯坦人的問題上，已經達到瘋狂的程度，並涉嫌種族滅絕和大屠殺。以色列的行為不僅違反了國際法，還與猶太人自己曾經遭受的苦難相矛盾。美國在這場不對稱戰爭中，通過提供軍火支持以色列，並置「自由」、「民主」、「法治」、「人權」於不顧，從中賺取利益。文章最後質疑台灣政府是否應該繼續支持美國和以色列，呼籲台灣應該重新審視其對中東問題的立場。"
31,評論 國內 藝文 專欄,王建煊觀點：我曾是肥貓！,好逸惡勞，待遇要好，工作還要輕鬆，這是人類共同的心態，因此， 肥貓處處可見，不足為奇。政府及公營事業裡之所以肥貓眾多，主要原因在於鐵飯碗打不破，制度若不改，肥貓難除。我的姪兒大學畢業時，我問他：「 想找什麼樣的工作？你們同學多數喜歡哪種工作？」他說，同學間流行一首打油詩，可以表達他們找工作的方向。這首打油詩是：「錢多事少離家近， 位高權重責任輕。睡覺睡到自然醒，數錢數到手抽筋。」我想不僅是年輕人如此，恐怕更是絕大多數人的期待。好逸惡勞，待遇要好，工作還要輕鬆，這是人類共同的心態。我民國五十年成功大學畢業，參加特考進入海關服務。當時政府為鼓勵出口，訂有保稅倉庫制度，進口原料放在保稅倉庫，可以暫免關稅，正式進口內銷則補稅，如加工外銷，即無須再納關稅，廠商可以減少資金積壓。保稅倉庫貨物的進出，海關要派員監守，俗稱「看倉庫」。當時我們這些大學剛畢業，考進海關的優秀大學生，卻都想去保稅倉庫，擔任看倉庫的工作，原因是工作極為清閒，薪水一毛也不少拿，有的廠商還會供應免費午餐。為此我們曾集體求見當時的關務署長，希望能去「看倉庫」。署長大為搖頭，慨嘆大學生為何如此沒有出息。錢多事閒，這種工作在民間是絕無僅有的，即使父親是老闆，兒子在公司裡工作，也不會有這種待遇。但在政府機關裡，這種美事就經常可見，幾乎每個機關裡，總有部分這樣好命的人。從前趙耀東先生任經濟部長時，稱這類人為「呆人」，呆人愈多，效率就愈差，如為國營事業，不是利潤率偏低，就是虧損連年。這些呆人，有人稱其為詐欺犯，因為公務員的薪水都來自納稅人，納稅人向政府買公共勞務；如果公務員提供的服務只值二萬元，卻以八萬元高價出售，就是詐欺行為。這些詐欺犯換成另外一個現在流行的名詞，那就是「肥貓」。稱這些人是詐欺犯或肥貓，他們一定會大聲抗議或憤憤不平，甚至說要告你。因為多年來就是如此，前輩們如此，現在如此，如果制度不改，將來恐怕還是如此。我從前在一個小機關擔任單位主管，我們單位文書打字工作甚多，聘有很多女性打字員，她們每天打一千字，我去了規定每天要打兩千字，加了一倍，她們都說來了一位魔鬼主管，現在一天要做兩天的事。但外面打字行的標準卻是每天四千字，這要怎麼說呢？民國50年代時，有位前輩，女兒大學畢業找工作，他不准女兒進公家機關。我們都很奇怪，政府機關是鐵飯碗，工作有保障，又不會太忙，不是很好嗎？這位前輩很有眼光，他說進公家機關工作清閒慣了，將來遇到繁重工作，就難以適任，堪當大任的能力降低。進外商機構，工作忙，規定嚴，凡事一板一眼，這等於在對孩子做魔鬼訓練，可有一身好本領，如果再有機會進公家機關，一定是好手一把。我在經濟部擔任政務次長時，分管國營事業，當時我們就發現如果要提高公營事業的績效，無論訂定何種規範，都沒有將公司民營化來得有效。當時成立了公營事業民營化小組，大力推動民營化，雖遇到不少阻力，但大勢所趨，民營化工作仍能逐步邁進，以致現在多數公營事業都已民營化。政府及公營事業裡呆人或肥貓太多，主要原因在於鐵飯碗打不破。如果以後公務員工作仍然是鐵飯碗，想要減少肥貓或詐欺犯，那是緣木求魚的。（相關報導：鄧鴻源觀點：論雙薪肥貓的問題｜更多文章）＊作者為前監察院長，本文原刊《台灣醒報》，授權轉載。,2,2024-09-02,https://www.storm.mg/article/5231717,https://d1pxdrw6gckt4w.cloudfront.net/wordcloud/1a2ba152-7391-4f92-80ab-33a5ce322946,https://d1pxdrw6gckt4w.cloudfront.net/network/d386e89c-8000-4ada-9208-c2f14fcfe0f8,王建煊在文章「我曾是肥貓！」中探討了公務員和公營事業中的「肥貓」問題，指出這類現象普遍存在且難以根除的原因在於鐵飯碗制度。王建煊分享了自己年輕時進入海關工作的經歷，當時許多大學生都希望獲得高薪、工作輕鬆且福利好的職位，這反映了人類普遍的心態。他提及，儘管這類職位在民間少見，但在政府機關中卻屢見不鮮，導致效率低下和經濟損失。他指出，有些公務員的效能低下，卻領取高薪，這等同於詐欺行為。他認為，要解決這一問題，唯一有效的方法是推動公營事業民營化，因為任何規範都不如民營化來得有效。王建煊強調，如果政府及公營事業的鐵飯碗制度不改變，肥貓現象將難以根除。
6,政治,柯文哲「無保請回」北院裁定理由曝光 ！北檢將抗告,針對京華城案，台北地方法院於1日晚間至2日凌晨召開民眾黨主席柯文哲、台北市前副市長彭振聲羈押庭。最終在凌晨3時15分許，北院以《貪污治罪條例》，裁定彭振聲、羈押禁見。柯文哲部分，法官認為柯文哲犯罪嫌疑不重大，無保請回，檢方將提抗告。北院表示，檢察官係以柯文哲涉犯貪污治罪條例第6條第1項第4款之對於主管或監督之事務圖利罪，以及第4條第1項第5款之違背職務收賄罪等語。而本案爭點在於110年9月9日都委會第783次會議決議中，外加20％之容積獎勵，使總容積率由560％提高至672％一事，以及基於該會議決議所生之：1.台北市政府以110年11月1日府都規字第11030520111號公告核定之都市計畫所外加20％之容積獎勵、2.111年10月18日臺北市都發局所核發之建照，客觀上是否合法，以及柯主觀上是否明知其為違法而仍為指示。但就20％之容積獎勵，其客觀上確有違法之情形，有監察院糾正案文在卷可稽，亦即認為不符合「都市計畫法第24條」(蓋無「當地分區發展計畫」)、不符合「都市更新建築容積獎勵辦法」(蓋與都市更新性質不同)，以及不符合公益性、對價性。（相關報導：京華城案羈押案大逆轉　柯文哲無保請回、彭振聲羈押禁見｜更多文章）本案關鍵在於柯文哲是否明知都委會將以形成違法決議之方式圖利京華城，或被告是否明知系爭20％之容積獎勵係屬違法。但柯文哲並非都委會之與會人員而無從直接知悉開會情形，自身亦無相關專業，則其主張其信賴形式上具專業性且為多數決之都委會決議，以及具相關專業之彭振聲之意見，尚非無據。而本案為最輕本刑5年以上有期徒刑之重罪，依目前卷證資料，就檢察官所提出之事證，尚存有其他合理解釋之空間，綜加計該等事由，亦尚未達前述「有犯罪之高度可能性」之程度，故尚不能認柯文哲就彭振聲、應曉薇等人主導都委會形成違法決議之行為已有所知悉或指示，或柯文哲明知系爭20％之容積獎勵係屬違法，而不能認柯文哲主觀上有明知違法(此為圖利罪及受賄罪之共同要件)之情形，因此檢察官就羈押要件中「犯罪嫌疑重大」之要件，其釋明尚有不足，裁定柯文哲無保請回。,2,2024-09-02,https://www.storm.mg/article/5231721,https://d1pxdrw6gckt4w.cloudfront.net/wordcloud/75a923f5-4bc9-4acf-b197-837f6b2dfc73,https://d1pxdrw6gckt4w.cloudfront.net/network/63e825c7-6ae0-4c5a-9391-eb7cb1dbf625,針對京華城案，台北地方法院於1日晚至2日凌晨召開羈押庭，最終裁定民眾黨主席柯文哲無保請回，而前台北市副市長彭振聲則被羈押禁見。法院認為柯文哲犯罪嫌疑不重大，然而，檢方將提出抗告。此案爭議主要圍繞在台北市政府於110年9月9日通過的都委會會議決議，批准外加20％的容積獎勵，使京華城總容積率提高至672％。法院指出，該容積獎勵在客觀上違反都市計畫法和都市更新建築容積獎勵辦法。然而，柯文哲並非都委會的與會人員，無法直接知悉會議情形，且無相關專業知識，因此法院認為檢方所提供的證據尚不足以證明柯文哲明知其違法，並裁定柯文哲無保請回。
6,政治,大爆冷！京華城案無保請回　柯文哲批檢方：兩天當中極盡壓迫跟凌虐,民眾黨主席柯文哲因京華城案遭聲押，台北地方法院今（1）日晚間8時召開羈押庭審理，最後柯文哲無保請回。柯文哲在凌晨3時30分許步出台北地檢署，向守在門口的支持者致意。柯文哲表示，謝謝大家這麼晚還來這裡，本來如果司法單位有問題可以傳訊他，不需要在清晨的時間出動搜索，去搜索台灣主要在野黨主席的住處、辦公室、中央黨部，特別是搜民眾黨中央黨部，無法理解目的是什麼。柯文哲說，搜索以後查扣手機跟硬碟，拿裡面的資料編故事，在這兩天當中，可以說是極盡壓迫跟凌虐，在最後答辯的時候，他和檢察官說，京華城840%容積率，當年送公開展覽以後，轉送都委會以後，都委會他完全沒有過問，因為作為市長不應當去過問單一各案，所以容積率840%他完全不知道，直到今年媒體講這件事情以後他才知道。柯文哲表示，因此他和檢方說，在目前所有證據中，沒有證據說他有去干預這個案子，最後答辯時，他也和法官說，從檢察官這兩天的詢問方式，已經知道他們的態度相當明確，這一次真正辛苦的是法官，扛住的最後、所有的壓力，但也要謝謝支持群眾，大家辛苦了。更多風傳媒獨家新聞：‧柯文哲被上銬！從政來最屈辱的1分鐘　走戒護通道卻被法警當江洋大盜（相關報導：柯文哲被上銬！從政來最屈辱的1分鐘　走戒護通道卻被法警當江洋大盜｜更多文章）‧柯文哲「無保請回」北院裁定理由曝光 ！北檢將抗告 ,2,2024-09-02,https://www.storm.mg/article/5231724,https://d1pxdrw6gckt4w.cloudfront.net/wordcloud/603234c1-5e23-4c9a-882f-2353b0f2f235,https://d1pxdrw6gckt4w.cloudfront.net/network/2ca4c2c5-9b24-4db1-8502-745e6089b9da,民眾黨主席柯文哲因京華城案遭聲押，台北地方法院在晚間羈押庭審理後，最終決定無保請回。柯文哲凌晨步出台北地檢署，向支持者致意並感謝他們的支持。他質疑司法單位的做法，批評在清晨搜索他的住處和辦公室，尤其是民眾黨中央黨部，並查扣手機和硬碟。柯文哲強調，作為市長，他從未過問京華城案的容積率問題，直到媒體報導後才知情，並堅稱目前無證據顯示他有干預此案。他認為檢方在兩天內對他進行壓迫和凌虐，並感謝法官承受壓力做出公正裁定。柯文哲的支持者和媒體對此事件高度關注，北檢將對北院的裁定提出抗告。
6,政治,京華城案羈押案大逆轉　柯文哲無保請回、彭振聲羈押禁見,針對京華城案，台北地方法院於1日晚間至2日凌晨召開民眾黨主席柯文哲、台北市前副市長彭振聲羈押庭。最終在凌晨3時15分許，北院以《貪污治罪條例》，裁定彭振聲、羈押禁見。柯文哲則是裁定無保請回。民眾黨主席柯文哲、前台北市副市長彭振聲涉嫌京華城弊案，遭台北地檢署依違背職務收賄罪、圖利罪聲押禁見，柯文哲歷經北檢、北院的馬拉松式訊問後，台北地院在9月1日晚間8時召開聲押庭，檢察官及律師當庭激烈攻防，法官2日認為柯文哲犯罪嫌疑不重大，無保請回。檢方將提抗告。至於彭振聲部分，北院表示，彭振聲涉犯涉犯貪污治罪條例第6條第1項第4款之對於主管或監督之事務圖利罪，犯罪嫌疑重大，有卷內事證可稽，且所涉為最輕本刑5年以上有期徒刑之罪。彭與應曉薇、沈慶京等人間之犯意聯絡、行為分擔為何等重要事實，均尚有未明，有待檢察官釐清，有羈押必要。結果宣判前，柯文哲夫人陳佩琪約在凌晨2時50分許到場，和民眾黨支持者及一眾黨公職、網紅館長陳之漢等人，在北檢門口靜坐。警方不敢大意，警力全員警戒，台北市警察局長李西河也親自到北檢門口坐鎮。柯文哲、彭振聲羈押庭分別在1日晚間11時及2日0時43分結束結束，檢方在凌晨3時諭知結果。而在1日一早，就有許多支持者到北檢門口聲援柯文哲，直到2日凌晨宣判結束都還在現場。柯文哲之所以無保請回，北院指出，依目前卷證資料，就檢察官所提出之事證，尚存有其他合理解釋之空間，綜加計該等事由，亦尚未達前述「有犯罪之高度可能性」之程度，故尚不能認被告就彭振聲、應曉薇等人主導都委會形成違法決議之行為已有所知悉或指示，或被告明知系爭20%之容積獎勵係屬違法，而不能認被告主觀上有明知違法(此為圖利罪及受賄罪之共同要件)之情形。綜上諸情，應認聲請人就羈押要件中「犯罪嫌疑重大」之要件，其釋明尚有不足。更多風傳媒獨家新聞：（相關報導：大爆冷！京華城案無保請回　柯文哲批檢方：兩天當中極盡壓迫跟凌虐｜更多文章）‧大爆冷！京華城案無保請回　柯文哲批檢方：兩天當中極盡壓迫跟凌虐‧柯文哲「無保請回」北院裁定理由曝光 ！北檢將抗告,2,2024-09-02,https://www.storm.mg/article/5231720,https://d1pxdrw6gckt4w.cloudfront.net/wordcloud/3f30d7ef-297f-4518-b681-43a960709025,https://d1pxdrw6gckt4w.cloudfront.net/network/3485bc02-173d-41f2-b6d4-15f854ea5e75,台北地方法院針對京華城案於1日晚間至2日凌晨召開羈押庭，審理民眾黨主席柯文哲及前台北市副市長彭振聲的羈押事宜。最終，法院以《貪污治罪條例》裁定彭振聲羈押禁見，並認為其涉犯圖利罪，犯罪嫌疑重大，需進一步調查。柯文哲則因犯罪嫌疑不重大，未達羈押要件，被裁定無保請回。檢方對此結果將提抗告。庭審期間，民眾黨支持者在北檢門口靜坐聲援，警方高度戒備。法院指出，現有證據不足以證明柯文哲知悉或指示違法行為，因此無法認定其主觀上有犯意。此案引起廣泛關注，並在社會上引發熱議。
1,風生活 品味生活,台灣也推「單身即地獄」實境秀？星宇航空與Vogue、GQ共同合作，放送富國島戀愛樂曲，看五位男女如何譜出浪漫樂章,"台灣也有戀愛實境秀了，單身男女們在譽有越南馬爾地夫美稱的「富國島」會擦出什麼火花？星宇航空在富國島航線首航前募集單身男女參加「戀夏富國島實境」活動，一同飛往美麗的富國島。在這片被蔚藍海洋環繞的熱帶天堂裡，五位從海選中脫穎而出的男女主角，在浪漫行程中會譜出怎樣的戀情？富國島位於越南西南方，除了是越南最大離島，更以清澈海水和潔白沙灘著稱。去年國人赴東南亞國家旅遊以越南居冠，其中富國島因免簽證優惠、完善的遊樂設施及多元的度假飯店選擇，成為繼峴港之後越南最熱門的新興旅遊景點。今夏最火熱的台灣戀愛實境秀更選在富國島盛大開播，透過由星宇航空聯手時尚雜誌VOGUE推出的「換個地方戀愛吧 Love in Phú Quốc」戀愛實境節目，邀請海選出來的單身男女們，在譽有越南馬爾地夫美稱的「富國島」一起打造仲夏浪漫曲。這五位分別來喜歡追劇、熱愛幽默自信另一半的巨蟹座珈儀、喜歡極限運動充滿搞怪想法的Ferfer，男生則有充滿自我想法的獅子座Kai凱勛、來自西雅圖喜歡旅遊、音樂、養寵物的浩恩、喜歡插畫有鄰家親切感的恩瀚，他們在旅程開始前便收到了任務卡，帶著期待與雀躍的心情，踏上為期五天的美好富國島星宇航空首航之旅。他們是否能在陽光與沙灘之間找到真愛？什麼會在島中萌芽？更想不到的是第一天就已經要做殘酷的想單獨約會對象的選擇……透過節目的全程拍攝，將分上下兩集陸續於星宇航空社群平台播出： 9月1日至10月27日，台北-富國島航線將放大至A330neo機型執飛，為往來兩地的旅客提供更便利的服務。（相關報導：越南富國島必遊7景點：大瀑布、遊樂園、寺廟、漁港，還有超美海岸風光｜更多文章）星宇航空與各大旅行社皆有合作推出富國島團體行程，五天四夜最低價新台幣35,900元起；除此之外，即日起至2024年10月31日止，購買星宇航空台中出發富國島團體旅遊，並以玉山星宇航空聯名卡全額支付行程費用，每張聯名卡可享現折500元優惠，詳情請洽各大旅行業者或至星宇航空官網。",2,2024-09-02,https://www.storm.mg/lifestyle/5230611,https://d1pxdrw6gckt4w.cloudfront.net/wordcloud/5dfac7cf-1f95-4dad-9c0d-8ae1bd3d2e90,https://d1pxdrw6gckt4w.cloudfront.net/network/5b0389bc-3666-48d2-b75b-cee609202933,台灣推出戀愛實境秀「換個地方戀愛吧 Love in Phú Quốc」，由星宇航空與Vogue、GQ聯合製作，選在有「越南馬爾地夫」之稱的富國島拍攝。節目邀請五位單身男女參加，包括喜歡追劇的珈儀、熱愛極限運動的Ferfer、充滿自我想法的Kai凱勛、來自西雅圖的浩恩及喜歡插畫的恩瀚。他們在富國島上展開五天浪漫之旅，並接受節目安排的任務挑戰。節目將分上下兩集於星宇航空社群平台播出。星宇航空也推出台北-富國島航線，並與旅行社合作推廣團體行程。
