文章類別編號,文章類別,文章標題,文章內容,文章來源編號,日期,文章網址,文字雲,關係圖,文章摘要
11,國際 政治 中港澳,教宗方濟各最長的亞洲行，恐捲入南海主權爭議，中梵關係何去何從？,87歲的天主教教宗方濟各從9月2日（周一）展開12天的亞洲行，行程包含印尼、巴布亞新幾內亞、東帝汶和新加坡。美聯社形容，這是方濟各任內「最長、最遠且最具挑戰性」的出訪，且在中國影響力漸增的亞太地區，中梵關係也將成為焦點。方濟各此行將飛行超過3萬2千公里，無論距離或是時長，都遠超過他過去44場外國之旅的任一場。他出訪新加坡的行程尤其值得關注。由於星國有四分之三的人口是華裔，華語亦是官方語言，教宗此行有機會促使梵蒂岡與北京接觸。方濟各過去也曾透過出訪行程向中國傳遞訊息，例如飛越中國領空時發電報問候，或是在附近地區向中國人民發出間接的敬意、友好與博愛訊息。在近期的一場訪談內，方濟各曾表示，中國人是「忠誠」的群體，「經歷了很多，仍然保持信仰」。這場亞洲之行，時機點選在中國與梵蒂岡之間2018年達成的臨時協議即將續簽之際，梵蒂岡也持續尋求與中國繼續溝通。上週，梵蒂岡 「滿意」且樂見中國正式承認95歲的石洪禎為天津教區主教，認為「這項措施是教廷與中國政府長期溝通而帶來的正面成果」。石洪禎被稱為「地下主教」，他在2019年由於拒絕加入中國天主教愛國會而遭到軟禁。不過，美聯社解讀，新加坡作為一個跟美中保持良好關係的區域經濟強國，方濟各此行可能也會捲入一場「持久的海上爭端」，亦即中國與菲律賓等東南亞國家在南海的主權爭議。教宗本來2020年便打算造訪亞洲，但當時因為新冠疫情爆發而延宕。如今他此行被視為對亞洲重要性的肯定；亞洲是天主教會受洗信眾和投身宗教志業者仍在成長的少數地區之一。方濟各此行預計將舉辦40多場活動。義大利學者法吉歐利（Massimo Faggioli）告訴路透社：「這展現出教宗方濟各力量。」華府智庫威爾遜中心（Wilson Center）印太專案主任後藤志保子（Shihoko Goto）則指出，在方濟各為健康問題苦惱之際，此行更「充分顯示亞洲對教會的戰略重要性」。根據官方數字，約有6百萬名天主教徒生活在中國，屬於 「中國天主教愛國會」的一員；該組織由國家監督，不承認梵蒂岡的權威。不過，中國天主教徒的實際人數，可能是這個數字的2倍；有估計指出，另有約6百萬人也忠於教宗，參加「地下教會」。（相關報導：教宗方濟各的中國夢會付出什麼代價？天主教媒體：台灣有危險｜更多文章）迄今為止，中國一直拒絕由教宗直接任命主教。在北京看來，這形同失去主權與干涉內政。到了2018年，中國與梵蒂岡針對任命主教事宜達成「臨時」協議，允許梵蒂岡和北京都承認的主教被「祝聖」（consecration）。該協議於2020年和2022年兩度延長期限。,2,2024-09-02,https://www.storm.mg/article/5231990,https://d1pxdrw6gckt4w.cloudfront.net/wordcloud/b937561d-a734-4ac8-96a2-aacd4a1de834,https://d1pxdrw6gckt4w.cloudfront.net/network/035c0742-8a16-4d5a-b6b6-e892158bfb4f,教宗方濟各於9月2日展開為期12天的亞洲行，造訪印尼、巴布亞新幾內亞、東帝汶和新加坡。此行是他任內最長、最遠且最具挑戰性的出訪，特別是在中國影響力日增的亞太地區，中梵關係成為焦點。這次訪問正值中梵2018年臨時協議即將續簽之際，梵蒂岡持續尋求與中國的溝通。教宗此行將飛行超過3萬2千公里，並舉辦40多場活動，突顯亞洲對天主教會的重要性。新加坡之行尤其值得關注，因為該國四分之三人口是華裔，可能促使梵蒂岡與北京接觸。然而，美聯社指出，教宗此行或可能捲入中國與菲律賓等東南亞國家的南海主權爭議。教宗方濟各曾表示，中國人是忠誠的群體，並對其信仰表示敬意。儘管中國不承認教宗直接任命主教，但2018年的臨時協議已兩度延長，允許雙方承認的主教被祝聖。此次亞洲行也被視為對亞洲戰略重要性的肯定。
6,政治,京華城案「關鍵共犯」！檢廉約談北市都委會執秘邵琇珮,北檢偵辦京華城案，懷疑現任北市府都委會執秘邵琇珮涉案，今天指揮廉政署約談邵女到案，正在廉政署接受訊問中，稍晚將移送北檢檢察官複訊。台北地檢署偵辦京華城案，認定前台北市長柯文哲、前台北市副市長彭振聲涉犯貪污治罪條例違背職務收賄及圖利等罪，將2人聲押禁見。台北地方法院今天凌晨3時裁定柯文哲無保請回、彭振聲羈押禁見。法院裁定指出，檢方聲押資料中的串證理由，包含共犯邵琇珮顯可疑因畏罪而潛逃中，法官因而認定彭振聲與本案共犯已有互相配合為不實陳述的動機及可能。北市副市長李四川今天表示，邵琇珮日前依規定請假，已經回到台灣，並向他強調沒有畏罪潛逃。,2,2024-09-02,https://www.storm.mg/article/5232075,https://d1pxdrw6gckt4w.cloudfront.net/wordcloud/47c5b93f-1394-4126-9040-0951ffd08404,https://d1pxdrw6gckt4w.cloudfront.net/network/11ea6f49-3eff-4d42-a77f-8fc7d04ea55c,台北地檢署正在偵辦京華城案，懷疑現任台北市政府都委會執秘邵琇珮涉案，廉政署今日約談邵女，目前她正在接受訊問，稍後將移送北檢檢察官複訊。檢方認定前台北市長柯文哲及前副市長彭振聲涉嫌違反貪污治罪條例，涉及職務收賄及圖利等罪，並對兩人聲押禁見。台北地方法院今日凌晨裁定柯文哲無保請回，彭振聲則羈押禁見。法院指出，共犯邵琇珮有畏罪潛逃嫌疑，這成為檢方聲押彭振聲的理由之一。北市副市長李四川表示，邵琇珮日前依規定請假，已回到台灣，並強調她沒有畏罪潛逃。
1,風生活 美食 居家 時事話題,全聯1款包子一吃成主顧！內行大讚「外皮Q彈、內餡微甜不膩口」：家中冷凍庫必囤,許多人早餐喜歡吃包子或饅頭，加熱方便又有飽足感，近日，就有網友在臉抒發文推薦全聯一款冷凍芝麻包，並大讚「表皮細白Q彈，剝開還會爆漿流沙」，貼文曝光後，許多吃過的網友紛紛留言大讚「吃了就不會想吃別家」。一名網友於臉書社團「我愛全聯-好物老實説」發文分享，全聯的1款冷凍芝麻包非常好吃，簡單用電鍋蒸一下，非常方便，口味不會過於甜膩，表皮細白Q彈，剝開後芝麻會爆漿流沙，令她大讚「吃他千遍也不厭倦」，不過食用時要小口吃，以免燙口。貼文曝光後，許多吃過的網友也紛紛留言表示，「最好的是大小剛剛好，芝麻味道濃麵體不甜，任何時候吃都不佔胃」、「我家2個兒子也很愛，開學了冷凍庫必囤」、「吃了奇美的芝麻包就不會想吃別家的」、「家裡必備早餐之一！！」、「我小女兒很愛吃芝麻包，尤其是這款」、「我家挑食女兒，會吃的早餐選擇之一」。除此之外，也有網友推薦其他口味，「我家也常駐奇美奶黃包，真的好吃」、「超推爆漿巧克力包」、「叉燒包也好好吃喔」、「奇美的黑糖饅頭也超讚」。除了用蒸的之外，也有些人會使用微波的方式，就有日本廚師分享教簡易的加熱方法，首先準備一個馬克杯，在杯子內加入約1公分高的水，接著把冷凍包子放在馬克杯上，使用微波爐600W加熱2分鐘，即完成。如果效果不理想，可以在加熱包子前在包面上灑上少許的水，並用保鮮膜包裹，使包子於微波爐加熱的過程中保持水分，就能獲得一顆飽滿及鬆軟的包子。完整討論至：《我愛全聯-好物老實説》（相關報導：包子、饅頭別只會用電鍋蒸！日本大廚教1招快速加熱法，2分鐘就能讓外皮飽滿Q彈｜更多文章）文／王若桐責任編輯／林俐,2,2024-09-02,https://www.storm.mg/lifestyle/5232032,https://d1pxdrw6gckt4w.cloudfront.net/wordcloud/25819aea-c434-4757-9c78-763a0e5ff7f8,https://d1pxdrw6gckt4w.cloudfront.net/network/1866d8c0-056c-4105-a1c4-9e2b0df793b2,近日，有網友在臉書社團「我愛全聯-好物老實說」發文推薦全聯的一款冷凍芝麻包。此款包子表皮細白Q彈，剝開後芝麻內餡會爆漿流沙，口感微甜不膩，深受消費者喜愛。網友表示這款芝麻包簡單用電鍋蒸一下即可食用，方便又美味，成為家庭冷凍庫必囤的早餐選擇。貼文曝光後，眾多網友留言表示同感，稱「吃了就不會想吃別家的」，並推薦其他口味如奶黃包、巧克力包和叉燒包等。除了電鍋蒸煮，還可用微波爐加熱，方法是將包子置於裝有少量水的馬克杯上，加熱2分鐘，效果同樣出色。這些多樣化的吃法讓全聯的冷凍包子成為家庭餐桌上的常客。
1,風生活 理財 彰化 時事話題,2024彰化縣65歲以上老人福利有哪一些？老人照顧津貼、老人生活津貼、重陽禮金…7項補助一次看,隨著台灣少子化及高齡化，老年人口比例逐漸升高，安養及福利的議題逐漸受到關注，那麼「彰化縣65歲以上的長輩福利有哪些呢？」為了保障長者老年生活，包括中低收入老人住宅設施設備補助、中低老人特別照顧津貼、中低收入老人生活津貼等。各項補助申請對象為何、能補助多少、該怎麼申請，一起看下去。（一）設籍彰化縣且實際居住彰化縣。（二）年滿65歲列冊低收入戶或領有中低收入老人生活津貼者。（一）屋頂防水、室內給水、排水設施設備。（二）廚房、衛浴設施設備。（如安全扶手、防滑地板等無障礙設施）。（三）住宅安全輔助器具。以申請人設籍並實際居住之處所為單位，且於3年內未接受相關補助者，每戶每次最高補助額度為新台幣5萬元為限；5年內最高補助額度以新台幣10萬元為限，按改善內容核實核定，且同一戶相同項目不得重複申請。（一）受照顧者資格條件：1.領有中低收入老人生活津貼。2.未接受機構收容安置、居家服務、未僱用看護（傭）、未領有政府提供之日間照顧服務補助或其他照顧服務補助。3.失能程度經直轄市、縣（市）主管機關指定或委託之評估單位（人員）作日常生活活動功能量表評估為重度以上，且實際由家人照顧。4.實際居住於戶籍所在地。（二）照顧者資格條件：1.年滿16歲，未滿65歲，且無社會救助法第五條之三第一款至第三款、第六款及第七款規定之情事。2.屬下列情形之一者：（1）同為領取中低收入老人生活津貼應計算家庭總收入全家人口之成員。（2）出嫁之女兒或子為他人贅夫者及其配偶。（3）受照顧者二親等以內之直系血親卑親屬。3.未從事全時工作，且實際負責照顧受照顧者。4..與受照顧者設籍及實際居住於同一直轄市、縣（市）。彰化縣中低收入老人特別照顧津貼，為每月補助照顧者新台幣5000元整（匯入照顧者郵局帳戶）。符合下列各款規定之老人，得依本法第十二條第一項規定，申請發給生活津貼（以下簡稱本津貼）：（一）年滿65歲，實際居住於戶籍所在地之直轄市、縣（市），且最近一年居住國內超過183日。（二）家庭總收入及財產符合下列基準：（相關報導：7505萬遺產全被充公國庫！律師曝1情況去世後「房子現金全沒了」，後代無法繼承｜更多文章）1.家庭總收入：按全家人口平均分配之金額，每人每月未超過中央主管機關或直轄市主管機關當年公布最低生活費標準之二點五倍，且未超過台灣地區平均每人每月消費支出之一點五倍。但有特殊情形，經直轄市、縣（市）主管機關報中央主管機關專案核定者，不在此限。,2,2024-09-02,https://www.storm.mg/lifestyle/5227814,https://d1pxdrw6gckt4w.cloudfront.net/wordcloud/7578078e-1717-43d6-87b0-cee67bee7bcd,https://d1pxdrw6gckt4w.cloudfront.net/network/c43bcc44-b214-4cbf-882d-9478cb2a316a,文章介紹了彰化縣2024年針對65歲以上老人的各項福利措施，包括老人照顧津貼、老人生活津貼、中低收入老人住宅設施設備補助等。這些福利旨在提升老年人口的生活品質，並針對不同需求提供相應的支持。主要福利包括：1. 中低收入老人住宅設施設備補助，涵蓋防水、給排水、廚房與衛浴設施等，每戶最高補助額度為5萬元。2. 老人特別照顧津貼，針對符合條件的照顧者每月補助5000元。3. 老人生活津貼，針對實際居住於戶籍所在地且家庭總收入及財產符合標準的老人發放。詳細的申請條件和程序也在文章中有所介紹，旨在讓有需求的老人及其家屬能夠充分利用這些福利。
1,風生活 財經 理財 保險 時事話題,快點上網查！勞保局發錢「平均每人進帳4.7萬元」千萬勞工都受惠，一鍵速查可領多少,勞動部今（2）日公布最新勞動基金運用績效，7月份金融市場表現穩健，勞動基金7月單月收益數為新台幣864億元，今（2024）年截至7月底的勞動基金評價後收益數為8857億元，收益率14.33％。另新制勞退基金收益數則為5980.9億元，收益率14.24％，以新制勞退目前1272萬帳戶看，平均每人分紅的數字上看47000元，假設去（2023）年底勞退帳戶有100萬元的金額，到7月為止，可領分紅超過14萬元。勞動部勞動基金運用局公布，整體勞動基金截至今年7月底止運用規模為6兆8530億元，今年截至7月底的評價後收益數為8857億元，收益率14.33％。資料顯示，新制勞退基金運用規模為4兆4715億元，收益率14.24％；舊制勞退基金運用規模為1兆557億元，收益率16.42％；勞保基金運用規模為1兆1002億元，收益率15.37％；就保基金運用規模為1709億元，收益率3.59％；勞職保基金運用規模為360億元，收益率0.97％；積欠工資墊償基金運用規模為187億元，收益率9.41％。此外，受衛生福利部委託管理的國民年金保險基金運用規模為6075億元，收益率為15.13％；受農業部委託管理的農民退休基金運用規模為176億元，收益率為16.13％。勞動基金運用局分析，回顧7月金融市場表現，美國總統候選人更換致總統大選政治不確定性升高，加上重要科技公司財報表現不佳，引發市場對於科技產業發展進度疑慮，然通膨數據表現穩定，且美國第2季經濟成長較前季表現亮眼，7月份主要金融市場漲跌互見。整體而言，勞動基金運用局認為，部分主要國家陸續啟動降息循環，但整體利率水準仍維持高檔，通膨數據見緩，但仍需觀察，加上地緣政治衝突不斷，且適逢全球主要國家選舉年，皆為金融市場帶來紛擾；將密切注意全球政經情勢，檢視布局策略及機動調整投資部位，強化基金運用效能，以提升基金長期投資效益。至於勞工最關心的新制勞退基金，單月收益增加582.3億元，每人分紅的數字從上次公布的42000元增加至47000元，再創新高；收益率則較上個月的12.96％提升至14.24％。假設去年底新制勞退帳戶裡面有100萬元的勞工，到7月為止，可分配的收益高達14萬元。不過，勞動部勞工保險局（下稱勞保局）提醒，新制勞退基金的收益是依每人專戶提繳的金額與時間來計算。因此，每名勞工實際獲得的收益數並不相同，勞動基金運用局會在每年2月底前通知勞工前一年的損益，在3月底前辦理收益分配。若上年度收益數是正數的話，每年4月前，勞工會有一筆分紅入帳，而這筆錢得年滿60歲時才能領取。勞保局指出，勞工年滿60歲即得請領退休金，提繳退休金年資滿15年以上者，可選擇請領月退休金或一次退休金；提繳退休金年資未滿15年者，只能請領一次退休金。領取退休金後繼續工作提繳，1年得請領1次續提退休金。若有以下3種情況者，可提早於60歲之前請領退休金：1.已領取勞工保險失能年金給付或失能等級1、2、3等一次失能給付者。2.領取國民年金法所定身心障礙年金給付或身心障礙基本保證年金給付者。3.非屬勞工保險、國民年金保險被保險人。若想查看新制勞退的帳戶餘額，可透過勞保局e化服務系統、以勞動保障卡及郵政金融卡至發卡銀行（郵局）ATM，或親自至勞保局各地辦事處臨櫃查詢勞退金個人專戶資料，包含：1.以行動電話認證、自然人憑證、虛擬勞保憑證或以行動自然人憑證上勞保局網站查詢及試算。2.以勞動保障卡查詢及試算。3.以郵政金融卡查詢。4.臨櫃查詢及試算。（相關報導：65歲退休只靠勞保根本不夠！專家用1招放大養老金「14年投報率52％」，老後沒工作多領20萬｜更多文章）勞工退休金點此查詢責任編輯／林俐,2,2024-09-02,https://www.storm.mg/lifestyle/5231885,https://d1pxdrw6gckt4w.cloudfront.net/wordcloud/8c56a210-f79a-4108-950a-0147d2752952,https://d1pxdrw6gckt4w.cloudfront.net/network/bc34a80f-b6e8-4063-9602-61710273b456,勞動部於今（2）日公布最新的勞動基金運用績效，顯示截至7月底，勞動基金收益達8857億元，收益率為14.33%。其中，新制勞退基金收益為5980.9億元，收益率14.24%，平均每人可分紅約4.7萬元，若去（2023）年底帳戶有100萬元，至7月底可獲分紅超過14萬元。勞保局強調，收益依每人專戶提繳的金額與時間計算，實際獲得收益數會有所不同。勞工年滿60歲可請領退休金，提繳年資滿15年者可選擇月退休金或一次性退休金，未滿15年者只能請領一次性退休金。若需查詢新制勞退帳戶餘額，可透過勞保局e化服務系統、勞動保障卡、郵政金融卡或親自至勞保局辦事處查詢。
11,國際 中港澳,中國外交官大發雷霆，施壓太平洋島國論壇公報刪台灣　過程遭媒體錄下,太平洋島國論壇屈服於中國要求，將本週在東加王國閉幕的領袖高峰會最終公報其中的台灣動議刪除。評論認為，此事凸顯北京是如何在作威作福，對這地區施加影響力。紐西蘭國家廣播電台（Radio New Zealand）報導，太平洋島國論壇（Pacific Islands Forum，PIF）最終文件納入台灣，引發中國太平洋島國事務特使錢波強烈不滿。吉里巴斯則認為，此事應該會對支持台灣的成員國造成後果。PIF秘書處8月30日發表的最終公報，其中一項內容為「領袖們重申1992年領袖們關於與台灣/中華民國關係的決定」。錢波為此氣急敗壞。他告訴記者，確認與台灣的關係「絕對是錯誤」、「必須改正」。PIF官網稍後將文件下架。紐西蘭國家廣播電台太平洋分部（RNZ Pacific）錄下錢波要求當時擔任主席的庫克群島總理布朗（Mark Brown）刪除台灣相關內容的片刻。可以聽到布朗告訴錢波：「我們會把它刪除，我稍後會跟你談論此事。」錢波大發雷霆的事隨即不脛而走。太平洋地區的政治評論認為，此事凸顯北京如何作威作福，對這地區施加影響力。PIF秘書處後來將新版公報上架。根據PIF發言人，那才是「正確版第53屆太平洋島國論壇公報」。新版內容刪除「與台灣/中華民國關係：66. 領袖們重申1992年領袖們關於與台灣/中華民國關係的決定」的內容。發言人在答覆電子郵件中說：「最終版本既不改變，也不影響會議決定和論壇領袖的任何現行決定。公報是基於共識的文件，反映整個太平洋島國論壇同意的決定與看法。」吉里巴斯代表團團長、吉里巴斯教育部長蒂博（Alexander Teabo）對錢波說法作出回應表示，台灣－中國「議題非常敏感」。他31日告訴紐西蘭國家廣播電台：「我們認為納入台灣可能造成問題。中國不只是我們可以依靠的正常的盟友…而且非常尊重。」蒂博表示，「附隨台灣的」太平洋國家「希望台灣被納入」這個論壇，「我們，大部分（太平洋島國論壇成員）追隨中國」。他還說，這次「出包」應該會有什麼後果，「我認為，是的，應該會」。紐西蘭國家廣播電台太平洋分部訪問的其他政府官員對此事反應不一，其中一位表示，PIF秘書處刪除台灣的內容令他們失望；另一位表示，此事沒什麼大不了。美國副國務卿坎博（Kurt Campbell）本週表示，華府歡迎任何國家致力於改善太平洋地區人民的生活水準，包括中國。他說：「中國參與其中一些領域是無可非議的。」不過，北京對這區域的意圖和投入情況仍然令他關切。坎博說：「中國支持不符合民主原則的成分，我們也看到非法捕魚的作法，這些特定領域確實令我們關切。對一個和平地區力量投射能力的潛在影響，這同樣令我們關切。」（相關報導：傳中國警告日本勿擴大晶片限制「否則將報復」　這產業恐倒楣掃到颱風尾｜更多文章）責任編輯／蔡娪嫣,2,2024-09-02,https://www.storm.mg/article/5231722,https://d1pxdrw6gckt4w.cloudfront.net/wordcloud/399e323b-da6c-4980-a35e-09e20cc41036,https://d1pxdrw6gckt4w.cloudfront.net/network/f7b558f9-eee6-4a55-9e0f-29cd371e6e03,        近日在東加王國舉行的太平洋島國論壇高峰會上，中國外交官錢波因最終公報中提及台灣而發怒，最終太平洋島國論壇屈服於中國的壓力，刪除了有關台灣的內容。錢波強烈反對確認與台灣的關係，並要求刪除相關內容，引發廣泛關注。該事件凸顯了北京在太平洋地區施加的影響力。吉里巴斯等國認為此舉可能會對支持台灣的成員國產生後果，並反映出太平洋島國在中台問題上的分歧。PIF秘書處隨後上架了刪除台灣內容的新版公報，強調這是基於共識的正確版本。美國副國務卿坎博表示，歡迎任何國家致力於改善太平洋地區人民生活，但對中國在該區域的意圖表示關切，包括其支持不符合民主原則的行為和非法捕魚等問題。
