文章類別,文章標題,文章內容,文章來源,日期,文章網址,文字雲,關係圖,文章摘要
風生活 品味生活 商業 市場動態 汽車,北非在地組裝量產、折合新臺幣 357 萬元起　全新 Jeep Grand Cherokee L 正式在埃及上市,"Stellantis 集團旗下美國越野品牌 Jeep 近日於埃及官方網站宣布，正式在埃及市場發表 Jeep Grand Cherokee L 車型，同時宣布恢復其在 Arab American Vehicles (AAV) 工廠之量產線，以在地國產化 Grand Cherokee L 車型並供應北非市場。埃及規格全車系標配第三排座椅 7 人座設定、前兩排 8 向電調座椅和加熱座椅，動力上則提供單一 3.6 升 V6 自然進氣汽油引擎，可輸出最大馬力 290hp、峰值扭力 35.5kgm。其正式建議售價為埃及鎊 540 萬元起，折合新臺幣約為 357.1 萬元。Jeep Grand Cherokee 車系首度於 1993 年登場，而現行第 5 代車型則於 2021 年首度亮相，在外觀方面，第五代 Grand Cherokee L 擁有方正的車頭造型，七道直柵水箱罩與頭燈間相連，也加入鍍鉻飾條點綴，車側則採用平整厚實的線條呈現，車窗上緣的鍍鉻飾條在 D 柱隨後擋風玻璃向下，前門設有車型銘牌，足踏 21 吋槍色烤漆鋁合金輪圈，車頂配置行李架，車尾採用橫置式 LED 燈組，排氣尾管採用雙邊單出的整合式設計。尺碼部分，Grand Cherokee L 的車身長寬高分別是 5,204x2,149x1,817 (mm)，軸距則為 3,091mm。內裝方面，第五代 Grand Cherokee L 車型標配三排 7 人座設定，其埃及規格車型具備黑色真皮座椅包覆搭配菱格紋車縫線點綴，雙前座可進行 8 向電動調整並支援加熱座椅，儀表板為 10.25 吋全數位式樣，中控台配置 10.1 吋 Uconnect® 5 NAV 多媒體系統，音響採用 9 支揚聲器 Alpine 音響系統，其餘配置包括：12 個 USB 連接埠、遠端引擎啟動、三區空調空調以及電動尾門等等。車迷注意！《風汽車》粉絲團開張囉，快來按讚追蹤成為VIP車迷，掌握最新全球車訊！ 預告全新純電休旅 Avenger 將於 9/26 正式在日本上市｜更多文章）安全防護方面，第五代 Grand Cherokee L 搭載 Adaptive Cruise Control with Stop & Go 全速域主動式定速系統、Active Lane Management System 主動式車道管理系統、Highway Assist System and Traffic Sign Recognition 高速公路輔助系統含交通標誌辨識功能、Drowsy Driver Detection 疲勞駕駛警示系統、全速域前方防撞系統含騎士及行人偵測、Blind-Spot Monitoring with Rear Cross-Path Detection 盲點偵測系統含後方橫向車流偵測、Park-Sense® Rear Park Assist System with Active Braking 倒車輔助系統含主動煞車、Intersection Collision Assist System 交叉路口防撞輔助系統、 360 度環景影像系統 (後鏡頭具清洗功能) 及 8 具 SRS 輔助氣囊等。",風傳媒,2024-09-09,https://www.storm.mg/lifestyle/5235576,https://d1pxdrw6gckt4w.cloudfront.net/wordcloud/a4520e82-c452-4c13-bc4f-e49b687c2ff2,https://d1pxdrw6gckt4w.cloudfront.net/network/5bb74bcf-c459-43df-bc8a-40f8023ad703,Jeep 近日在埃及市場推出全新 Jeep Grand Cherokee L 車型，並在當地的 Arab American Vehicles 工廠恢復量產，以供應北非市場。新車標配第三排座椅，提供 7 人座設定，並配有前兩排 8 向電調座椅和加熱座椅。動力方面，搭載 3.6 升 V6 自然進氣汽油引擎，最大馬力 290hp，售價為埃及鎊 540 萬元起，約合新臺幣 357.1 萬元。第五代 Grand Cherokee L 擁有方正車頭、七道直柵水箱罩、21 吋槍色烤漆鋁合金輪圈等設計。內裝方面，標配三排 7 人座黑色真皮座椅、10.25 吋全數位儀表板、10.1 吋 Uconnect® 5 NAV 多媒體系統、Alpine 音響系統、三區空調及電動尾門。安全配置包括全速域主動式定速系統、主動式車道管理系統、疲勞駕駛警示系統、盲點偵測系統及 360 度環景影像系統等。
風生活 品味生活 市場動態 汽車,遠渡太平洋而來　全新大改款 2025 年式 Infiniti QX80 正式於北美市場展開交車作業,"繼今年 3 月稍早，Infiniti 正式發表亮相全新世代 Infiniti QX80 車系，並於 6 月時宣布正式於北美市場展開販售後，如今正式迎來首批車主交付。Infiniti USA 近日 (09/05) 於官方網站宣布，全新 2025 年式 Infiniti QX80 於近日正式於北美市場展開首批車主交付作業，並經由原廠精心策畫交車流程與個性化體驗，令車主們興奮不已。全新 2025 年式 Infiniti QX80 提供 Pure、Luxe、Sensory 及 Autograph 共計 4 款車型，不含運送雜費的建議售價自 82,450~110,595 美元起 (約合新台幣 268.4~360.1 萬元起)。外觀方面，全新大改款 2025 年式 Infiniti QX80 承襲該廠最新的 “Artistry in Motion” 設計語彙，強調極簡主義和精緻細節，外觀設計宛如 2017 年登場的 QX80 Monograph 概念車進化版，車頭運用大量的幾何造型所構成，包括以竹林為發想意象之新式樣雙弓形家族水箱罩、造型修長 LED 大燈等都能看見 Infiniti 新世代面貌，另外前保險桿增加了貫穿車頭的下氣壩設計，同時二側也具有直立式的燈組。車側部分可以看到前葉子板採用源自於竹子縱向的通風口設計，整體車身線條相當簡約，並採用隱藏式的車門把手設計，同時還搭載大尺碼的黑紅多輻式鋁圈，在碩大的車身下一點也不突兀。而車尾方面則模仿波光粼粼的水面，搭配兩側的面積同樣寬廣的長方形尾飾管以及由日本禪園的沙紋飾條妝點，霸氣感油然而生。車迷注意！《風汽車》粉絲團開張囉，快來按讚追蹤成為VIP車迷，掌握最新全球車訊！ 2025 年式 Infiniti QX80 的座艙可看出仍然是典型的日系豪華風格，其具備雙 14.3 吋螢幕，也擁有 semi-aniline 皮質包覆座椅，搭配 open-pore 木質飾板，也具備 64 色個人化氛圍照明，而車內的科技也增加 Invisible Hood View 透視引擎蓋功能，並且在車載系統內整合多樣 Google 功能，而聽覺部分則導入 24 支揚聲器的 Klipsch Reference Premiere 音響。此外，全新世代 QX80 還將搭載生物溫度感測系統，該系統感知器整合於車頂後視鏡上方，可檢測後排乘客的體溫，而隨時調整車室空調溫度，前排駕駛與乘客完全不需動手調控空調界面，即可達到最佳冷房效果。動力配置方面，全新大改款 2025 年式 Infiniti QX80 捨棄過去的 V8 引擎，改為全數採用 3.5 升 V6 雙渦輪增壓引擎，可輸出 450hp 最大馬力及約 71.34kg-m 峰值扭力，搭配 9 速手自排變速系統，驅動方式標準為後輪驅動，也可升級為四輪驅動，而底盤部分則具備電子氣壓懸吊配置。據原廠表示，Infiniti QX80 原型概念車 QX Monograph 的誕生是 Infiniti 為了向世人展示品牌全新的設計思維，透過獨特的家族式水箱罩以及令人著迷的 LED 燈組，讓看過的人都能留下深刻的印象。由於 QX80 車系是以北美、俄羅斯及部分中東市場為主的大尺碼車款，因此並不在總代理裕隆日產汽車的導入名單之中。不過 QX80 在國內還是有少數貿易商有導入販售，為部分多金買家提供除了 BBA 品牌以外更具個人風格的選擇。國內市場方面，Infiniti 總代理裕隆日產未曾導入過 QX80 尺碼的車型，目前車型尺寸最大的款式為 QX60 車系，未來導入的可能性，有待本站持續追蹤。（相關報導：銷量逐步下滑　傳美規 Infiniti Q50 將於 2024 年底前停產｜更多文章）",風傳媒,2024-09-09,https://www.storm.mg/lifestyle/5235541,https://d1pxdrw6gckt4w.cloudfront.net/wordcloud/e9732e3b-fc7a-4ba7-b338-0140435a5269,https://d1pxdrw6gckt4w.cloudfront.net/network/32537128-59c4-46f4-84c9-d98dcdcca55c,"全新大改款的2025年式Infiniti QX80正式在北美市場開始交車。Infiniti於今年3月發表這款新車，並於6月宣布開售。此次交車活動特別設計了個性化體驗，讓車主倍感興奮。2025年式QX80提供Pure、Luxe、Sensory和Autograph四款車型，售價從82,450到110,595美元不等。外觀設計承襲“Artistry in Motion”理念，強調極簡主義和精緻細節，並配有雙弓形水箱罩和修長的LED大燈。內飾部分，座艙采用雙14.3吋螢幕、semi-aniline皮質座椅和open-pore木質飾板，並具備64色氛圍照明和24支揚聲器的Klipsch音響系統。新車搭載3.5升V6雙渦輪增壓引擎，最大馬力450hp，標配9速手自排變速系統和電子氣壓懸吊配置，並提供後輪驅動和四輪驅動選擇。QX80主要面向北美、俄羅斯和部分中東市場，未在台灣導入，但仍有少數貿易商進口販售。"
品味生活,法國巴黎人壽保險高峰會  彭金隆：IFRS 17將為保險業帶來正向結構性改變,永續已成為全球企業的經營顯學。隨著2026年台灣將正式接軌保險合約會計準則IFRS 17及新一代清償能力制度TW-ICS，法國巴黎人壽身為通路保險合作夥伴及信用保障保險的領導者，面對國際保險監理趨勢下，有責任協助通路合作夥伴共同促進保險永續發展，並響應金管會促進金融科技發展政策，於今(6日)假茹曦飯店舉辦法國巴黎人壽「洞見保險趨勢，引領保障新主流」保險高峰會。由法國巴黎人壽總經理戴朝暉偕同法國巴黎保險集團亞洲區總裁See See Ooi聯袂出席，邀請到金管會主委彭金隆擔任嘉賓，為本次保險高峰論壇揭開序幕。法國巴黎保險集團總裁Pauline Leclerc-Glorieux 也透過影片現身致詞，感謝過去26年來，台灣團隊的努力與合作夥伴的信任，共同締造了多項輝煌成就；未來，法國巴黎保險也將致力於開發各項創新技術與產品，為客戶帶來更好的使用者體驗和解決方案，持續作為台灣合作夥伴們最堅實的後盾！該活動邀請到國內外知名的保險與金融科技產學專家，政治大學風險管理與保險學系張士傑教授和黃泓智教授、台灣金融科技協會名譽理事長蔡玉玲、法國巴黎保險集團首席分析及人工智能官Michael de Toldi以及OneDegree Group新加坡商甯寶數位科技有限公司資訊長周彥儒蒞臨，分別就政策、國際到亞洲及台灣的市場趨勢、AI人工智慧提出觀點、解方與實例分享，並在財金專家─商周集團顧問朱紀中的引導下進行精采對談，與現場近百位的銀行、保經代合作夥伴交流，聚焦消費者保障、共創保險新局。金管會主委彭金隆於會中致詞時表示，IFRS 17/TW-ICS將在2026年如期實施，台灣壽險業由於時空背景因素，商品長期偏重儲蓄，但壽險具有多重功能，未來應該要更著重保障的部分。而為了協助壽險業接軌新制，保險局推出了三階段相關措施，會給業者充足的因應調整時間，希望在業者規模不斷擴大、環境挑戰日益劇烈時，能協助業者持續強化韌性，強化體質。（相關報導：月薪3萬怎麼買iPhone 16？網提2解方：打工族也能輕鬆買｜更多文章）另一方面，彭金隆也指出，人工智慧(AI)是新政府非常重視的政策方向，各部會的首長都被要求上AI課。站在金管會的立場，非常鼓勵業者提出科技工具解決問題，也非常歡迎業者提出需求。未來，金管會將陸續放寬相關法令，也會主動詢問業者需要協助的部分，推動金融科技的持續發展。彭金隆特別表示，法國巴黎人壽是在台灣投資最多的外商保險公司，希望法巴人壽繼續投資台灣，台灣是個有發展願景的市場！,風傳媒,2024-09-09,https://www.storm.mg/stylish/5235681,https://d1pxdrw6gckt4w.cloudfront.net/wordcloud/3abdd692-67af-4bc6-84c4-99842d1e1824,https://d1pxdrw6gckt4w.cloudfront.net/network/a9c7fce8-5cc4-4221-8c69-0597891bb7cc,法國巴黎人壽於茹曦飯店舉辦保險高峰會，探討保險趨勢與保障新主流。總經理戴朝暉及亞洲區總裁See See Ooi出席，金管會主委彭金隆擔任嘉賓。彭金隆指出，台灣將於2026年實施IFRS 17及TW-ICS，並強調壽險業需更注重保障功能。保險局推出三階段措施，協助業者適應新制。他也提到人工智慧是新政府的重點政策，鼓勵業者利用科技工具解決問題。法國巴黎保險集團總裁Pauline Leclerc-Glorieux透過影片致詞，感謝合作夥伴的信任，並表示將致力於創新技術與產品開發。活動邀請多位國內外保險與金融科技專家，就政策、市場趨勢及AI等議題進行探討，並與銀行、保經代合作夥伴交流，共創保險新局。彭金隆特別強調，法國巴黎人壽是台灣最大外商保險公司，希望其繼續投資台灣這個具發展潛力的市場。
政治,黃揚明揭北檢調查「小沈1500」洩密案是緩兵之計　預言鄭銘謙怎麼對付黃國昌,京華城案持續延燒，媒體日前報導，檢廉在柯文哲住家搜出記載「2022/11/1小沈1500沈慶京」的隨身碟，疑是柯文哲涉嫌收賄1500萬元，但引起民眾黨質疑媒體消息來源就是檢方，違反偵查不公開原則，北檢今（9）日也主動分他字案調查。媒體人黃揚明對此表示，北檢針對洩密當然只能否認，但主動分案調查只是「緩兵之計」，是為應付即將來臨的立法院預算會期。黃揚明在臉書發文指出，記者跑獨家天經地義，但是有保護消息來源的義務，當明確說出檢方是消息來源，北檢怎麼能裝死？但北檢當然只能否認洩密，否則可是有檢察官要負刑事責任，但說要主動分案調查，這只是為了應付即將來臨的立法院預算會期的緩兵之計。黃揚明也預想未來將在立法院中上演的場景，他描述，在立法院司法委員會中，民眾黨立委黃國昌質詢時，痛批檢方違反偵查不公開原則，要求法務部長嚴查洩密。法務部長鄭銘謙淡淡地回應：北檢已公開否認洩密，也將全案主動分案調查中，基於偵查不公開原則，我無法透露偵辦進度。更多風傳媒獨家新聞：（相關報導：「1500小沈」是北檢洩案情？黃揚明揪三立記者「說溜嘴」：不就證明是檢方放消息｜更多文章）‧ 「1500小沈」是北檢洩案情？黃揚明揪三立記者「說溜嘴」：不就證明是檢方放消息‧ 誰放話給媒體？柯文哲USB「1500小沈」外洩惹議　北檢主動分案自清,風傳媒,2024-09-09,https://www.storm.mg/article/5235651,https://d1pxdrw6gckt4w.cloudfront.net/wordcloud/2549f683-b7ce-4bd2-bac1-a3448a41f652,https://d1pxdrw6gckt4w.cloudfront.net/network/0d89c135-5412-4fcb-b8cf-877160202a2f,媒體報導稱，北檢在柯文哲住家搜出的隨身碟中記載了「2022/11/1小沈1500沈慶京」，引發柯文哲涉嫌收賄1500萬元的質疑。民眾黨懷疑媒體消息來源於檢方，違反偵查不公開原則。北檢主動分案調查此事，但媒體人黃揚明認為這只是為了應付即將來臨的立法院預算會期的緩兵之計。他在臉書上強調，記者有保護消息來源的義務，北檢裝死否認洩密是為了避免檢察官負刑事責任。黃揚明預測，在立法院司法委員會中，民眾黨立委黃國昌將痛批檢方違反偵查不公開原則，要求法務部長鄭銘謙嚴查洩密，但鄭銘謙可能會以偵查不公開為由拒絕透露進度，進而引發更多討論。
風生活 科技 產業觀點 商業 科技 市場動態 汽車,基於鴻海電動車平台 日本 Sharp 發表 LDK+ 概念廂型車,日本 Sharp 日前發表 LDK+ 概念廂型車，採用鴻海科技集團 (富士康) 所開發之電動平台，並與 フォロフライ 株式会社共同開發，該車預計將於 9 月 17 日至 18 日舉行的「SHARP Tech-Day 24 Innovation Showcase」技術展示活動上正式亮相。車迷注意！《風汽車》粉絲團開張囉，快來按讚追蹤成為VIP車迷，掌握最新全球車訊！ 作為一款將車內視為「延伸客廳」、專注於「車輛靜止」的純電概念廂型車，運用 Sharp 專利的「CE-LLM」人工智慧技術、AIoT 技術、感測技術等；後排座椅可向後旋轉，且當車門關閉時，兩側窗戶將會自動屏蔽外界，系統還能根據乘用者喜好自動調整空調和亮度，營造出舒適且隱私的空間。尾部安裝有 65  吋液晶顯示幕，不僅可以用作沉浸式劇院，還可以做為遠距辦公室。此外，車輛配置的蓄電池和太陽能電池透過人工智慧實現最佳整體能源管理，當住家遭遇停電等情況，將能做為緊急電源使用。此外，鴻海科技集團將於今年 10 月 8 日 (二)、9 日 (三) 在台北南港展覽館一館舉行「鴻海科技日 Hon Hai Tech Day 24（HHTD24）」，除了有全新的智慧電動車解決方案，展現科技創新的速度外，也會說明集團如何將 AI 的應用導入三大智慧平台。同時，還將舉辦多場專業論壇，涵蓋科普技術、智慧製造、智慧電動車、智慧城市、數位健康及鴻海研究院 NExT Forum 等多個領域。本站《小七車觀點》屆時將會前往現場進行採訪，帶給讀者第一手報導。（相關報導：Alpine預告A390 Beta電動休旅將於巴黎車展現身 ｜更多文章）,風傳媒,2024-09-09,https://www.storm.mg/lifestyle/5235481,https://d1pxdrw6gckt4w.cloudfront.net/wordcloud/82177df9-6e6b-44ec-bb14-b60aa1680679,https://d1pxdrw6gckt4w.cloudfront.net/network/bd895762-8e9f-4f35-8b14-808f432ad2ff,日本 Sharp 近日發表了與鴻海科技集團合作開發的 LDK+ 概念廂型車，該車採用鴻海的電動平台，並預計在「SHARP Tech-Day 24 Innovation Showcase」上亮相。這款純電動廂型車主打將車內打造成「延伸客廳」，利用 Sharp 的專利技術如 CE-LLM 人工智慧、AIoT 和感測技術。車內設計亮點包括後排座椅可向後旋轉、車門關閉時自動屏蔽外界、根據乘客喜好自動調節空調和亮度等。車尾64吋液晶顯示幕可用作沉浸式劇院或遠距辦公室，且車輛的蓄電池和太陽能電池可在住家停電時提供緊急電源。今年10月8日至10月9日，鴻海科技集團將在台北南港展覽館舉行「鴻海科技日 HHTD24」，展示全新智慧電動車解決方案及 AI 應用的三大智慧平台，並舉辦多場專業論壇。
風生活 學長姐說 職場 求職必讀 工作秘辛 時事話題,南部什麼工作月薪6萬以上？內行點名1職業不看學歷「比國營、公務員還高薪」：10年賺千萬,"求職過程中，「薪資」往往是選擇工作的重要考量要素。近日就有一名網友表示，他在高雄一家傳產工廠工作多年，發現傳統產業在不加班的情況下月薪超過六萬實在少見，因此，他考慮轉行，便發文詢問「在南部什麼樣的工作有6萬以上」，貼文曝光後，有內行人士回應道，「跑船」的收入非常可觀。一名網友於Dcard發文表示，自己今年25歲，現於高雄一家傳產工廠工作，過去也一直在傳產發展，然而，他發現做這行如果不加班，月薪達到6萬的機會非常少，因此考慮轉行，尋找高薪機會，便發文詢問「在南部，高雄這個地方，除了傳產與業務性質之外，有什麼樣的工作不需靠加班也能月薪6萬以上 ？」貼文曝光後，許多網友紛紛留言表示，「學校老師、高等公務員或企業中的中高階主管吧！我自己科技業傳產都做過， 沒聽說其他工作可以週休二日又不加班不輪班還可以破6w的」、「中油7萬4，一年領滿4個月左右」、「電銲工月薪10萬以上，鷹架工月薪8.9萬」、「南部國營月薪6萬up」、「高考公務員、國營職員、公股銀行，這些都要考試跟全國分發或選區考試，有可能留在南部」、「職安人員6萬」、「國軍士官年資到就有」。其中，有內行網友點名「跑船」，「你單身的話可以去跑船，我朋友非工科，也沒有背景，不聰明，也不想輪班，就去跑船、看他都沒什麼機會花錢，每年靠岸都還放兩個月的假，這兩個月他也不完全閒著，半天兼職半天休假這樣，他給我看過他存款說真的我蠻羨慕的，有上千萬」、「去跑船薪水更高生活品質更好」、「傳產薪水最高應該就是跑船跟大貨車司機了，都破10萬」。過去，也曾有一名遠洋貨櫃船的乙級AB（幹練水手、Able Seaman, A.B）分享自己的職業心得，他大學快畢業時，發現船員薪水不錯，因此自費9萬報名受訓乙級船員班，實習結束後成為乙級AB，月薪大約10萬，再加上一些獎金，年薪大約110萬。工作內容包括敲鐵鏽、油漆、操舵、打掃住艙、靠港梯口當值，「帶纜、靠港比較累而已，這些工作做久就懂了，沒啥『難度』」。他表示，「船上安全是最重要的，沒人能強迫你做危險的事」，並強調人際關係在這行業中尤為關鍵。他指出，跑船的優點是「存錢速度非常快，能甩開同齡人好幾條街」，且還有機會前往不同國家見世面；然而，缺點在於「生活很單調乏味」，每天過著一成不變的日子，對於內心容易感到孤獨的人並不適合，此外，休假期間沒有薪水，無法經常與家人、朋友或伴侶見面，「小心被戴綠帽」。（相關報導：除了公職，哪些工作能安穩做到65歲？一票網友推薦「這幾種」：到80歲都可以｜更多文章）責任編輯／林俐",風傳媒,2024-09-09,https://www.storm.mg/lifestyle/5235646,https://d1pxdrw6gckt4w.cloudfront.net/wordcloud/da298f2a-14e3-4762-ab8f-b46e06692f6e,https://d1pxdrw6gckt4w.cloudfront.net/network/b539a2c0-ba41-414d-88a1-c7588781fce2,有網友在Dcard上發文詢問在南部有什麼工作月薪可以達到6萬元以上，並且不需要加班。帖子引發了大量回應，不少人提議學校老師、高等公務員、企業中高階主管等職位，但這些工作通常需要考試和競爭。內行人士特別提到「跑船」這個職業，認為其收入頗高，且生活品質優越。一名網友分享他朋友跑船的經歷，指出跑船不需要特別的背景或輪班，每年還有兩個月的假期，存款甚至達到千萬。另一位遠洋貨櫃船船員也分享了他的經驗，表示跑船的月薪約10萬元，年薪可達110萬元，但生活單調且休假無薪，與家人朋友的見面時間有限。這些職業建議讓不少考慮轉行的人有所啟發，但也提醒大家考慮各職業的優缺點。
政治,柯文哲放棄抗告是正確決定？律師曝實務經驗：現在壓力轉到檢方身上,民眾黨主席柯文哲涉京華城容積率案，台北地方法院日前裁定羈押禁見，外見都在關注，柯文哲是否將提起抗告，進入下一波的攻防，但沒想到今（9）日，柯文哲透過辯護律師發表聲明，決定放棄抗告。對此，律師王至德在臉書發文直言，柯文哲這一步是正確的決定，接下來的壓力就轉到檢察官身上了。針對柯文哲宣布不提起抗告，王至德認為，這是個正確的決定，因為從以往的實務經驗來看，被押進去的被告，鮮少有在起訴之前被放出來的，就算柯文哲抗告，要放出來的機率也相當小，而且不只是抗告成功的機率小，就算是聲請交保，實務上也很少核准的，再抗告或聲請交保其實多半是白費工夫。王至德表示，其實後續要提抗告或聲請交保成功的機率真的不高，比較像是在做個立場的宣告，不過畢竟柯文哲的身分也跟一般老百姓不同，或許法官也會有不同的做法也說不定。王至德強調，反正柯文哲現在決定不抗告，接下來壓力就轉到檢察官身上了，畢竟押票一次最長2個月，最多再延長1次2個月，換句話說檢察官得在4個月內起訴柯文哲，不然就得把柯文哲放了，這麼大型的案件要在4個月內結案起訴也是相當辛苦。更多風傳媒獨家新聞：‧ 柯文哲羈押禁見確定不提抗告！律師團3點聲明曝光：他不願讓法院為難（相關報導：「1500小沈」是北檢洩案情？黃揚明揪三立記者「說溜嘴」：不就證明是檢方放消息｜更多文章）‧ 「1500小沈」是北檢洩案情？黃揚明揪三立記者「說溜嘴」：不就證明是檢方放消息,風傳媒,2024-09-09,https://www.storm.mg/article/5235621,https://d1pxdrw6gckt4w.cloudfront.net/wordcloud/2c80c2c1-8375-47aa-8cb4-97e0f9fee969,https://d1pxdrw6gckt4w.cloudfront.net/network/c944bce9-6eed-428b-9b06-4021bcfb247c,民眾黨主席柯文哲涉及京華城容積率案，台北地方法院日前裁定羈押禁見。柯文哲今日通過辯護律師發表聲明，決定放棄抗告。律師王至德在臉書上表示，這是正確的決定，因為從實務經驗來看，被押進去的被告在起訴前被放出來的機率很小，抗告或聲請交保多半是白費工夫。柯文哲不抗告的決定將壓力轉移到檢察官身上，檢察官需在最長4個月內起訴柯文哲，否則必須將其釋放。王至德強調，柯文哲的特殊身份可能會讓法官的決策有所不同，但總體來說，不抗告是更為明智的選擇。
