文章類別,文章標題,文章內容,文章來源,日期,文章網址,文字雲,關係圖,文章摘要
風生活 品味生活,獨特釀造工藝、嚴選稀有酒桶，BUSHMILLS鉑仕麥酒廠「巨人堤道珍藏系列」席捲台灣精品威士忌收藏市場,愛爾蘭威士忌擁有悠久且豐富的歷史，更曾在19世紀主導全球威士忌市場，當時，其製作技藝源自愛爾蘭修道士帶來的蒸餾技術，並因其獨特的三次蒸餾工藝而聞名於世，這一工藝使愛爾蘭威士忌口感更加順滑，更具備輕柔細膩的特質，聲譽遠播於歐美洲等地，成為世界威士忌的領頭羊。愛爾蘭威士忌的釀造原料更來自得天獨厚的自然資源，特別是豐富的硬水，來自愛爾蘭北部的純淨水質富含礦物質，對威士忌的風味產生了深遠影響，這些天然水源為發酵和蒸餾過程提供了優越的條件，進一步提升了威士忌的品質和風味。位於北愛爾蘭安特里姆平原邊緣的岬角，從海中突出黑色巨大玄武岩石柱的「愛爾蘭巨人堤道」，在人們的靈感中有了巨人橫跨海洋到蘇格蘭的傳說，也因其特殊景象而成為了世界遺址。在距離這世界遺址約5~10分鐘的車程，便是最古老的威士忌酒廠「BUSHMILLS鉑仕麥」所在之處。BUSHMILLS鉑仕麥酒廠自1608年以來傳承職人之魂與頂級工藝，400多年來穩坐世界最古老威士忌酒廠寶座。BUSHMILLS鉑仕麥除了堅持使用最頂級的原料，並採用「三次蒸餾」與「三桶工藝」極致釀酒手法，更有著來自山谷富含礦物質的獨特清澈水源，得天獨厚的自然環境再加上對細節與技術的堅持，造就出威士忌的經典。BUSHMILLS鉑仕麥的「三次蒸餾」是世界上少見技術，不僅能夠讓酒體更加芳香醇淨，亦使酒液口感更為滑順；加上酒廠內世代傳承的「桶匠」與首席調酒師一同為酒款挑選和搭配最適合的橡木桶，每一次釋出的威士忌，都是在精選的木桶中耐心熟成多年，這些都使BUSHMILLS鉑仕麥能以風味獨特、口感格外細緻且豐富的威士忌酒款享譽全球。BUSHMILLS鉑仕麥更以「巨人堤道」命名，推出了「巨人堤道珍藏系列」酒款，該系列以獨家且神秘的小批次限量版愛爾蘭單一麥芽威士忌聞名於世，嚴選稀有酒桶、超長第三桶熟成工藝、原桶強度、非冷凝過濾的技術，使此系列的威士忌每一絲風味都如同巨人堤道的海岸線般充滿驚艷。（相關報導：神秘巨浪來襲！極致奢華的精品收藏首選！ BUSHMILLS鉑仕麥 巨人堤道珍藏系列威士忌 台灣獨家限量上市｜更多文章）特別要提到與市面上的其他高端威士忌系列截然不同，「巨人堤道珍藏系列」每款威士忌都來自於精心挑選的稀有且創新的酒桶，這些酒桶來自世界各地，造就了獨特而非凡的風味，才能在高端市場中脫穎而出。此次BUSHMILLS鉑仕麥「巨人堤道珍藏系列」更精選出兩款全新威士忌在台灣獨家上市，特別挑選「頂級稀有酒桶」作為第三桶，並以「超長時間過桶熟成」的工藝收尾，讓台灣酒饕都能品嚐到鉑仕麥單一麥芽威士忌的全新高度。,風傳媒,2024-09-09,https://www.storm.mg/lifestyle/5235450,https://d1pxdrw6gckt4w.cloudfront.net/wordcloud/096b7e0f-4245-40a9-87ec-41a218d10d9f,https://d1pxdrw6gckt4w.cloudfront.net/network/c500ed06-ef9f-4480-bad7-c20f2fc08a93,BUSHMILLS鉑仕麥酒廠以其悠久歷史和獨特釀造工藝聞名，特別是其三次蒸餾技術和嚴選稀有酒桶，使得其威士忌口感更加順滑和豐富。位於北愛爾蘭的鉑仕麥酒廠，從1608年以來一直堅持使用頂級原料和傳統工藝，並結合得天獨厚的自然環境，產出風味獨特的威士忌。「巨人堤道珍藏系列」是其最新推出的限量版酒款，以獨特的第三桶熟成工藝和原桶強度，帶來如同巨人堤道海岸線般驚艷的風味。此次在台灣限量上市的兩款新品，特別選用頂級稀有酒桶，讓台灣酒迷體驗到鉑仕麥單一麥芽威士忌的全新高度。
風生活 理財 新知 汽車 法律 時事話題,右轉沒打方向燈「被檢舉開罰1.8萬元」！駕駛1關鍵原因扭轉判決，罰金一毛都不必繳,駕駛開車要注意！2023年8月，一名張姓男子開車行經台南市，因不熟路況忘記打方向燈便右轉，險些與直行機車發生擦撞，事後張男遭到騎士檢舉《道路交通管理處罰條例》第43條的「任意驟然變換車道迫使他車讓道」，被罰款18000元，外加記點3點。據司法院裁判書系統，張男開車行經台南市區，因不熟路況便靠導航帶路，在交岔路口時聽到導航指令要右轉，於是在趕著轉彎時忘記打方向燈，險些與直行的李姓騎士發生擦撞。當時騎士緊急停車並確實有向右靠，所以事後持行車紀錄影片，依《道路交通管理處罰條例》第43條的「任意驟然變換車道迫使他車讓道」向警方檢舉，警方也認定張男違反，依法製單舉發，開罰18000元罰鍰、記點3點。張男向南投監理站申訴未果，於是向台中高等行政法院地方行政訴訟庭提起行政訴訟，法官指出，修正後的《道路交通管理處罰條例》第43條條文，擴及逼車、擋車的行徑處罰，此項條款的「任意」、「迫使」是指有不計後果的意圖，不顧道路上其他車輛，逼迫其因怕撞到而讓道，但張男的違規行徑不符合此定義，因此撤銷判決。至於張男是否依違反《道路交通管理處罰條例》第42條規定「汽車駕駛人不依規定使用燈光者，處1200元以上3600元以下罰鍰」之處罰，由交通單位依其權責自行決定。資料來源：《司法院裁判書系統》（相關報導：汽機車交通違規罰單金額怎麼查詢？監理1服務超好用，繳納罰款、申訴一次搞定｜更多文章）責任編輯／蔡惠芯,風傳媒,2024-09-09,https://www.storm.mg/lifestyle/5233232,https://d1pxdrw6gckt4w.cloudfront.net/wordcloud/01d1f43d-4232-447b-9af5-a96edcf6bc11,https://d1pxdrw6gckt4w.cloudfront.net/network/19ed0d0c-5412-405f-95a3-45fa88ef2501,張姓男子在台南市因不熟路況未打方向燈右轉，險些與直行機車發生擦撞，被依《道路交通管理處罰條例》第43條檢舉並罰款18000元及記點3點。張男申訴未果後向台中高等行政法院提起訴訟，法官指出該條文「任意驟然變換車道迫使他車讓道」需有不計後果的逼車意圖，張男行為不符此定義，遂撤銷罰款判決。至於張男是否因違反《道路交通管理處罰條例》第42條「不依規定使用燈光」而受罰，則需由交通單位自行決定。
政治,柯文哲羈押好慘？阿扁感同身受「PTSD復發」　憶受刑往事嘆：痛苦吞滿腹,民眾黨主席柯文哲因涉京華城案被羈押禁見，前總統陳水扁日前貼出與柯文哲合照並寫下「醫生照顧受刑人，同是天涯淪落人」，耐人尋味。陳水扁今（9）日再於臉書表示，自己的舉動無關政治也不涉司法，他也沒看過京華城案的卷證，更不是承辦該案的律師或院檢司法官，不能也不會去做輿論審判的幫兇，「只是看到柯醫師，與他照顧過的受刑人我，進到熟悉的禁見牢房，我的創傷後壓力症候群PTSD再度復發，三不五時心悸甚至喘不過氣來，心事誰人會知，痛苦吞滿腹！」陳水扁表示，自己日前放了一張與柯文哲的合照，讓有些人大作文章，未免想像力太豐富了，為什麼除了政治以外，還是政治？阿扁在鬼地方生病了，第一個主張應成立阿扁民間醫療小組並親自擔任召集人的是柯文哲 。當年沒幾個醫師敢站出來，辯護律師更一位難求，有人辦了一半就解除委任去投靠當權派。也因為阿扁罹患以額顳葉為主的腦神經退化症，在保外就醫期間，柯市府文獻館搶先為阿扁出版第一本回憶錄，書名叫《堅持》。陳水扁說，最近阿扁勤練書法的，特別寫「堅持」來感謝柯文哲，無關政治也不涉司法。阿扁沒看過京華城等案的卷證，更不是承辦該案的律師或院檢司法官，不能也不會去做輿論審判的幫兇。阿扁曾擔任鄭南榕的辯護律師，沒想到當事人與律師，雙雙關進看守所，同為天涯淪落人。如今看到柯文哲，與他照顧過的受刑人阿扁，進到熟悉的禁見牢房；再回想當年阿扁女兒被媒體霸凌，從台北堵到紐約，連小孩都被學校家長拉布條拒絕入學。阿扁的創傷後壓力症候群PTSD再度復發，三不五時心悸甚至喘不過氣來，心事誰人會知，痛苦吞滿腹。更多風傳媒獨家新聞：（相關報導：幕後》沈慶京、應曉薇律師不是阿貓阿狗！曾是辦陳水扁的特偵組　檢廉一看就知是硬仗｜更多文章）‧ 幕後》聽到柯文哲被羈押禁見的那一刻　平常「惦惦」的台北市都發局公務員變這樣‧ 幕後》柯文哲終結者臉色蒼白！王俊力親自領軍　拿下民眾黨獅子王才敢回檢察長大會,風傳媒,2024-09-09,https://www.storm.mg/article/5235445,https://d1pxdrw6gckt4w.cloudfront.net/wordcloud/111f6185-8619-46c0-a224-271a6b89dba0,https://d1pxdrw6gckt4w.cloudfront.net/network/eab1634e-9456-4a07-9726-075dd2ac6a8a,前總統陳水扁因民眾黨主席柯文哲涉京華城案被羈押禁見，發表貼文表達感同身受。他表示自己的創傷後壓力症候群（PTSD）因此復發，並回憶起自己被羈押時的痛苦經歷。陳水扁強調此舉無關政治，僅因他曾受到柯文哲照顧。柯文哲當年曾成立阿扁民間醫療小組並擔任召集人，並在阿扁保外就醫期間為其出版回憶錄《堅持》。陳水扁感謝柯文哲的幫助，並表示自己沒有涉入京華城案的任何司法程序。陳水扁還提到自己曾擔任鄭南榕的辯護律師，兩人同樣被關進看守所，感嘆同為天涯淪落人。陳水扁的貼文引起了媒體和社會的關注，再次引發對兩人處境的討論。
國際 財經 國際財經,歐洲石油巨頭出面領投　美國新創公司要利用熔鹽捕捉排碳、已獲9.6億元注資,歐洲石油巨頭殼牌（Shell）與埃尼集團（Eni）領投氣候科技新創公司Mantel Capture的早期階段募資，這家公司利用熔鹽技術來捕捉煉油廠、工廠和其他工業場所的二氧化碳排放。路透社報導，在產生二氧化碳的可確認地點進行碳捕集，或稱為「點源」（point source）碳捕捉，可讓污染者減少碳排，並保留現有的昂貴基礎設施，但一些環保人士批評，這種方法會延續碳排問題。總部位於波士頓（Boston）的Mantel目標是利用熔鹽從煙囪排放中提取95%的碳。Mantel表示，這種方法相當具成本效益，因為過程中利用工業熔爐和鍋爐內部的極高溫環境，所需額外能源遠少於競爭對手的碳捕集方法。Mantel執行長哈利戴（Cameron Halliday）接受訪問時表示：「這是一項能徹底改變能源產業的技術，但我們所做的事仍然存在風險。」在A輪融資中募集的3000萬美元（約新台幣9億6122萬元）使Mantel能在一家造紙廠建立示範計畫，這項計畫每年可捕捉1800公噸的碳排，大約是實驗室環境下每天捕捉到半公噸碳排的10倍。哈利戴表示，在數十萬公噸至數百萬公噸的規模下，Mantel理論上可以每公噸30至50美元的價格進行碳捕集，這使得它在許多提供碳捕集獎勵或收取排碳稅的國家具有經濟可行性，且價格遠低於競爭對手的方法。Engine Ventures是Mantel的早期投資者，也參與這次A輪融資。Engine Ventures普通合夥人卡爾尼（Michael Kearney）說：「我對這些數字非常有信心，這意味著它將成為許多重工業產業中，成本最低的減排方案。」殼牌創投（Shell Ventures）負責人麥奎利（Hector MacQuarrie）表示，殼牌會先觀察試驗情形，再深入探討自身的潛在用途，但他補充說，這項技術能讓難以減排的產業更容易實行碳捕集。麥奎利說，如果成功、如果他們能實地部署，這將有可能大大改變碳捕集成本。（相關報導：【新新聞】新鮮人薪資揭秘！多熱門科系爆冷「5年薪資漲幅最低」　理組「1科系」成加薪黑馬｜更多文章）責任編輯：許詠翔,風傳媒,2024-09-09,https://www.storm.mg/article/5235447,https://d1pxdrw6gckt4w.cloudfront.net/wordcloud/6061ff17-1193-414c-9fcf-507a1b1985d6,https://d1pxdrw6gckt4w.cloudfront.net/network/b2c7d38d-a4d5-41f2-a77f-49d7263a531a,歐洲石油巨頭殼牌（Shell）與埃尼集團（Eni）共同領投美國新創公司Mantel Capture的早期募資，該公司利用熔鹽技術來捕捉煉油廠、工廠等工業場所的二氧化碳排放。這種技術被稱為「點源」碳捕捉，目標是從煙囪排放中提取95%的碳，並且具成本效益。Mantel執行長哈利戴表示，這項技術有潛力改變能源產業，但仍存在風險。公司已募集到3000萬美元（約新台幣9.6億元），計劃在一家造紙廠建立示範計畫，每年可捕捉1800公噸碳排。這項技術有望在多個國家以每公噸30至50美元的成本進行碳捕集，經濟可行性強，並可能成為重工業產業中成本最低的減排方案。殼牌創投負責人表示，若技術成功，將大大降低碳捕集成本，讓難以減排的產業更易實行碳捕集。
國際 中港澳,「我想約你去打羽毛球」成為新的性暗示：香港性教育惹議，應該如何跟中學生談「性」,「我想約你去打羽毛球」在香港無意間成為了一種新的「性暗示」，這跟香港教育局一份涉及性教育的支援教材有關，裡面提及，若有性衝動的時候可到運動場去打羽毛球。近日，香港教育局上載了一份中三級的「公民、經濟與社會科」支援教材，當中有關「青少年與親密關係」的部分引起社會廣泛關注，裡面提及有關學生需堅決拒絕婚前性行為、建議學生簽訂承諾書定下親密界線等內容都惹來爭議。不少聲音質疑教育局的性教育教材裡面的價值觀過時落後、未能跟上現代社會的發展，遭到教育局發文反駁，教育局局長蔡若蓮在電視節目上回應指教材並非保守，又稱需要向初中學生提供傳統的價值觀，而中華文化社會是一夫一妻婚姻制度。有關注人士擔心，該份教材會進一步鞏固與「性」有關的污名與禁忌、或會增長校園內的欺凌行為，甚至會為性小眾學生帶來更多困擾。今年22歲的Circle接受BBC中文訪問時表示， 看完教育局的教材後，感覺是要把其希望推行的價值觀加諸在學生身上，而忽視了其他理解性與性別的角度可能性，她認為這份教材也強化了一些固有、刻板的性別角色定型，「已經假定了男性會有性衝動，但本身女性都可能會有性的慾望或者好奇，這是強化了男生或女生應有的樣子」。Circle記得，自己中學時候就讀有宗教背景的女校，當學校邀請外面的機構為學生教授性教育的時候，都會偏向尋找意識形態比較保守的機構，除了不支持婚前性行為外，「也會用一種讓你感到內疚的角度去教授，例如講未婚懷孕，就會說如果要墮胎你會非常內疚，不斷強化你是在殘害一個生命的角度」。另一方面，她在課堂裡面接觸到的性教育機會其實並不多，她記得主要是在上生物課的時候，老師會以科學的角度去教授，「會感受到老師教這部分的時候會輕輕帶過，例如教授一個性行為是怎樣發生的時候，只以簡單一句說大家彼此相愛然後就發生，用很科學的語言去講這一個行為，會感覺到他（老師）的尷尬」。今年剛滿18歲並正在就讀國際學校的中學生Callie也有類似的感受。Callie說，中一至中三的時候，她就讀香港本地男女校，到了中四才轉到國際學校。在初中的時候，她同樣是在生物科的課堂上接觸到相關的知識，但她覺得並不足夠，「可能只是講到人體的時候會講幾句，男同學在聽到這些的時候又會笑，老師都會尷尬」。她認為這樣的氣氛很難有一個機會讓老師詳細地教授到性教育。（相關報導：ECFA上路十年後，北京、上海、廣州等9城擬開放外商獨資醫院准入中國市場｜更多文章）香港家計會自1981年起，每五年都會做一次「青少年與性研究」的調查，以了解中學生的性觀念及性知識水平。據2022年發佈的「2021年青少年與性研究」調查，發現中學生的性知識仍然未如理想，特別是中一及中二學生維持較低分水平；另一方面，中學生透過社交媒體接觸色情內容、影像性暴力及裸聊的情況有所增加。當時家計會呼籲學校及家庭應加強推行全面性教育、以及媒體與資訊素養教育，建議應從較低年級開始推行。,風傳媒,2024-09-09,https://www.storm.mg/article/5235383,https://d1pxdrw6gckt4w.cloudfront.net/wordcloud/80c39d65-10d8-411b-817d-487b7515f6a7,https://d1pxdrw6gckt4w.cloudfront.net/network/f83707f7-be2b-46f3-9652-5078b1c26d49,香港教育局的性教育支援教材引發爭議，其中「我想約你去打羽毛球」這句話成為新的性暗示。教材建議學生運動以紓解性衝動，並強調拒絕婚前性行為和簽訂承諾書設定親密界限。批評者認為教材價值觀過時，未能跟上現代社會發展。教育局局長蔡若蓮回應稱教材非保守，強調傳統價值觀和一夫一妻制。有關注人士擔心教材會鞏固性污名和禁忌，並可能導致校園欺凌和對性小眾學生造成困擾。受訪者Circle和Callie回憶其性教育經驗，認為內容偏保守且不足夠。香港家計會的調查顯示，中學生性知識水平不理想，且接觸色情內容的情況增加，呼籲學校和家庭加強全面性教育。
風生活 學長姐說 職場 求職必讀 時事話題,薪水近5萬！政府開出職缺，只要高中畢業、不限科系都能應徵,今（113）年森林護管員招考將在11月9日至10日兩天登場，並自9月9日起開始接受報名，只要具備高中以上學歷，年齡65歲以下，身體狀況良好，就有機會加入守護山林的行列。林業保育署宜蘭分署指出，本次甄試將分二階段舉行，第一階段術科測驗在宜蘭縣羅東鎮公正國小進行，包括實地騎乘125C.C.（含）以上循環檔機車，及負重20公斤跑走1500公尺體能測驗兩項，成績均合格者，始得參加第二階段筆試（包含作文、森林及自然保育概論）及口試，預計錄取8人，並擇優增列候補人員。宜蘭分署進一步說明，森林護管員是守護台灣山林的前線尖兵，負責業務包括森林資源調查、經營與保護；野生動植物保育與棲地保護、步道巡護；林地管理及植樹造林、撫育；防災工程測繪與監工、林道與林業設施維護；綠色森林產業與山村部落社區輔導等。本次錄取人員，每月薪酬自32296元起，未來依每年考核結果最高可逐級晉升至48444元。此外除了薪酬，並享有勞健保、勞工退休金、休假及未休畢慰勞假加班費年終工作獎金等各項福利，而且可根據上班地點併計高山或偏遠地區加給；如因執行野生動物、森林資源調查及國土保育等高風險勤務，另依項目支領各級山地巡護作業費。（相關報導：公務員只排第十！最想做的工作前10名公開，第一名不須學歷、賺超多｜更多文章）宜蘭分署再次提醒，甄試報名一律採通訊報名方式，不受理現場與電子郵件報名。應考人應於113年10月9日前（郵戳為憑），以限時掛號郵寄至265008宜蘭縣羅東鎮中正北路118號「農業部林業及自然保育署宜蘭分署森林護管員甄試試務組」。簡章暨報名表逕至下載，考生務必詳閱甄試簡章。【森林護管員報名表】點此下載責任編輯／梁溶珈,風傳媒,2024-09-09,https://www.storm.mg/lifestyle/5235446,https://d1pxdrw6gckt4w.cloudfront.net/wordcloud/e6de7d94-61d7-4cf5-bf5f-8da3ae3fa379,https://d1pxdrw6gckt4w.cloudfront.net/network/fb015e42-f58d-4a54-9ae0-64be8a60f8fb,今年森林護管員招考將於11月9日至10日舉行，9月9日起接受報名。應徵者需具備高中以上學歷，年齡65歲以下，身體狀況良好。考試分為兩階段，第一階段是術科測驗，包括騎乘機車及負重跑走，合格者可參加第二階段的筆試和口試。預計錄取8人，薪水起薪為32296元，最高可達48444元，並享有勞健保、退休金、休假等福利。宜蘭分署提醒，報名需通訊方式，截止日期為10月9日。
風生活 市場動態 汽車,Ford盛夏續推優惠！Kuga 79.9萬起再升級車體險、Focus升級360度環景系統,"Ford盛夏續推旗下各車款超值購車優惠，於活動期間2024年8月31日至9月30日止，凡至全台Ford展間試駕全車系，即可獲得7-11商品卡，再享週週抽共3.7萬元旭集、饗饗雙人餐券。而本月入主Ford Kuga享專案價79.9萬起（含舊換新），全車系享升級車體險，並贈五年原廠保固；本月入主Ford Focus國產車系專案價74.9萬起（含舊換新），並免費升級搭載1080P高畫質影像鏡頭之360度環景影像系統外（市值45,800元），再享首年免牌燃稅，另Focus ST Wagon享百萬0利率高額分期優惠；純電跑旅Ford Mustang Mach-E Premium四驅長續航享專案價199.9萬典藏入主；Ford Ranger XLT則享舊換新現金價119.8萬起，敬請消費者把握超值優惠入主Ford好車。車迷注意！《風汽車》粉絲團開張囉，快來按讚追蹤成為VIP車迷，掌握最新全球車訊！ Kuga和Ford Focus國產車系升級最高5年全方位安心保固，安心駕馭無後顧之憂；入主Ford Mustang Mach-E再享15,000元充電金，開啟純電生活新體驗。歡迎軍職、警消、公職、教師等專業人員親臨Ford展間賞車試乘，感受Ford車款的卓越性能與優質服務。（相關報導：7部9月國產、進口超值休旅SUV總整理、一次看！｜更多文章）Ford Kuga車型EcoBoost 180超質XEcoBoost 180旗艦EcoBoost 180 ST-Line SportEcoBoost 250 AWD ST-Line PerformanceEcoBoost 250 AWDVignale建議售價94.9萬元101.9萬元107.9萬元119.9萬元123.9萬元專案價（含舊換新）79.9萬元86.9萬元91.9萬元101.9萬元105.9萬元",風傳媒,2024-09-09,https://www.storm.mg/lifestyle/5235112,https://d1pxdrw6gckt4w.cloudfront.net/wordcloud/7bfee405-2659-4818-9e55-5d032c73e5c4,https://d1pxdrw6gckt4w.cloudfront.net/network/4958b842-465a-40b7-9946-583b5b96f6f6,"Ford在盛夏期間推出旗下各車款的超值購車優惠，活動時間從2024年8月31日至9月30日。凡是在這段期間到全台Ford展間試駕全車系的顧客，即可獲得7-11商品卡，並有機會參加每週抽獎贏取價值3.7萬元的雙人餐券。本月購買Ford Kuga可享專案價79.9萬元起（含舊換新），全車系升級車體險及五年原廠保固。Ford Focus國產車系則提供專案價74.9萬元起（含舊換新），並免費升級搭載1080P高畫質影像鏡頭的360度環景影像系統。此外，Focus ST Wagon享有百萬0利率高額分期優惠，純電跑旅Ford Mustang Mach-E Premium四驅長續航版的專案價為199.9萬元，並享有15,000元充電金。Ford Ranger XLT則提供舊換新現金價119.8萬元起。Ford Kuga和Ford Focus國產車系升級最高五年全方位安心保固，讓車主無後顧之憂。特別針對軍職、警消、公職和教師等專業人員，Ford邀請到展間賞車試乘，感受其卓越性能與優質服務。"
