文章類別,文章標題,文章內容,文章來源,日期,文章網址,文字雲,關係圖,文章摘要
評論 政治 公共政策 國內 風書房 專欄,陳立誠觀點淨零碳排？別鬧了！2030見真章,源無小事，錯誤能源政策可以動搖國本，臺灣能源政策已一錯再錯，但眼看又要三錯四錯。非核家園顯然是錯誤政策，不說別的，台電董事長日前坦承臺灣北部每年缺電200億度，核二兩部機每年可發電150億度，核二延役立即解決北部缺電問題。更別提廢核電而以綠電取代每年發電成本將增加1500億元，以核電可延役20年計算，以綠替代核，白白增加3兆元發電成本。強推風電產業，又是另一大錯。2018年的離岸風電標案，為了強推風電產業，高價決標，全民將為此多付近兆電費。今年風電新標案因強制規定國座化，臺灣被歐盟一狀告上世界貿易組織WTO，看來建立風電產業美夢又將泡湯，臺灣人民為此交了近兆元學費，結果是兩頭落空。但與2050淨零排放的政策相較，以上兩者都是小巫見大巫。六部核電正常運轉時，約可提供臺灣20%電力。去年風電提供臺灣電力也不過3%。但現在政府動刀者為提供臺灣電力85%的化石能源，如計入交通與工業，化石能源占全臺能源供應更超過90%。淨零碳排政策對臺灣的衝擊難以估計。問題是不只臺灣，全球2050淨零目標都不可能達成。淨零排放正反意見在世界各國都有熱烈辯論，臺灣獨無。個人近日出版的「淨零碳排？別鬧了！2030見真章」一書即係填補此一空白。為讓更多民眾了解此一重大問題，本書電子版可免費下載。但此一議題極為複雜，本書開頭及各章起始均有針對各章每篇文章之導讀，讀者可較易掌握重點。借媒體一角披露本書導讀，希望即使未讀此書之民眾，對此議題也可有初步認識。本書分為兩輯，第一輯「無碳能源」共三章，解析無碳能源；第二輯「減碳政策」共六章，討論淨零政策。輯一：無碳能源──能源議題極為複雜，要兼有專業知識及實務經驗方能抓到重點。但自從全球暖化成為顯學後，極多學者跨界下指導棋，但未必正確，經常差之毫釐，失之千里。本章前三篇文章即指出前後任中研院院長及工研院院長的指導棋未見高明，第四篇佐以IEA報告及中國工程院院士忠告供參考。太多人對所謂前瞻能源充滿憧憬，以為是解決全球暖化達到淨零排放的靈丹妙藥，在臺灣尤以政府大力鼓吹的地熱及氫能為最。本章前三篇文章即破解此類迷思，第四篇文章解釋何為綠能滲透率及何以其對綠能開發有所限制。（相關報導：阿將伊崮喜瀾觀點：冰與火之歌，地球正在譜寫的神祕樂章｜更多文章）對於能源的無知，造成許多虛幻期待，本章頭兩篇文章指出之電力零成長及暴衝減碳即為顯例，國外也有此一現象；第三篇文章指出比爾蓋茲對能源轉型過於樂觀；第四篇引述能源大師史密爾文章，解釋為何能源轉型需要一兩個世代的時間；第五篇推介之紀錄片全面檢討對能源轉型過度樂觀的迷思。,風傳媒,2024-09-09,https://www.storm.mg/article/5235214,https://d1pxdrw6gckt4w.cloudfront.net/wordcloud/5234dd69-75ea-4fba-9677-a42e6627c9d0,https://d1pxdrw6gckt4w.cloudfront.net/network/67df2f6d-aad1-40a7-ba88-8a60c79f2814,陳立誠在文章中批評臺灣的能源政策錯誤，特別是非核家園政策，指出核二延役可以解決北部缺電問題，而用綠電取代核電將大幅增加發電成本。此外，強推風電產業也被認為是錯誤決策，臺灣為此付出了高昂代價，包括被歐盟告上WTO。他強調2050淨零排放目標不現實，全球都難以達成，臺灣推行此政策將面臨巨大衝擊。陳立誠的新書《淨零碳排？別鬧了！2030見真章》免費提供電子版，書中分為兩輯，解析無碳能源及減碳政策，旨在讓更多人了解能源議題的複雜性及其對臺灣的影響。
評論 投書 國內,觀點投書：論賴政府強化原民偏鄉英語教育政策之必要,"現今台灣社會輿論因柯文哲貪腐遭羈押禁見，在政治上吵吵鬧鬧，誰還記得台灣偏鄉英文教育？2024年的台灣約有300多所偏鄉學校，這些學校主要分布在交通不便的山區、離島及其他偏遠地區。這些學校面臨著高師資流動率及教學資源不足的挑戰，政府及相關機構正積極採取措施，以改善這些情況。但近年來台灣偏鄉學生的學力已出現明顯落差，而國家政策研究基金在今年六月指出，112學年度偏鄉學生會考英語科「待加強」的比率高達55.2％，而台灣偏鄉教育的改善，不僅是教育政策的核心之一，也是實現教育公平的重要步驟。賴清德總統曾提出AI補位「多一個助教、多一個老師」偏鄉教育政策支票，賴總統落實了沒？另外，缺乏穩定師資的陪伴與引導是台灣偏鄉教育的破口之一，根據立法院專題研究報告，偏遠地區國中小師資流動率長期高於全國平均水平。例如，110至112學年度，偏遠地區國小教師流動率分別為1.7%、1.61%及1.21%，高於全國國小教師流動率的1.13%、1.42%及1.06%；偏遠地區國中教師流動率分別為1.15%、1.26%及1.21%，同樣高於全國國中教師流動率的0.66%、0.60%及0.70%。這種高流動率對學生的學習產生了負面影響，穩定師資的缺乏導致偏鄉學生難以獲得持續性的教育支持與關懷，這問題賴總統拿出行動了沒？而筆者曾深入台灣偏鄉小學，聽到許多台灣偏鄉孩子正需要幫助的故事，例如隔代教養的阿媽與阿公為補償孩子沒有父母陪伴的心理，一昧溺愛孩子，學校老師做親師溝通，反而被訓斥了一頓。也有年輕父母未善盡養育責任，讓自己小孩餓肚子，導致在學校孩子常問：「老師，今天營養午餐可不可以打包回家，因為媽媽不煮飯，我不要餓肚子。」也有個案低學歷沒有專業專長的家長，因過度沉迷宗教，自以為在實踐老子「無為」精神，不作為不管事，合理化放任叛逆子女說謊汙衊師長，導致家庭教育失能，上述偏鄉教育問題賴總統關心了沒？對於台灣偏鄉教育的未來，賴總統應抱有更高的期待和規劃，政府應該制定長期的教育政策，專門針對偏遠地區的教育發展，確保教育資源能夠均衡分配。其次，社會各界應加強對偏遠地區教育的關注和支持，鼓勵更多企業和公益組織參與偏遠地區教育的改善工作。同時，應該推動更多的師資培訓計畫，不僅針對現職教師，也應涵蓋準教師，讓他們在進入偏遠地區前就具備必要的教學技能和心理準備。應推動遠距教學，利用現代科技手段，讓偏遠地區的學生也能享受到優質的教育資源，最後，台灣偏鄉父母親職教育，更是需要賴政府政策支持。後來，觀察到劉影梅特聘教授因投入陽明交大「大學社會責任（University Social Responsibility, USR）實踐計畫」，長期關心宜蘭縣南澳鄉的泰雅族原住民三十多年，也發現當地原民孩子雖然體育競賽表現優秀，甚至出國拿到冠軍，但運動員職業生命不長，如果教育部和國科會合作透過「遠距直播教英語」等政策，教導這些原民偏鄉孩子學習「體育專業英文」，使孩子獲得「國際教練」、「國際裁判」的專業英文能力，更能開展其職業生涯，筆者深深認同劉博士的寶貴觀察，也實為賴政府可進行的原民偏鄉英語政策的實施方向！（相關報導：觀點投書：談「法理情」 VS. 「情理法」的思辨教育！｜更多文章）最後，賴總統也曾是弱勢孩子，偏鄉的弱勢孩子、原民孩子也是台灣的孩子，需要新政府透過教育政策來做制度的正向改變。＊作者為教育博士、台北市議員政策顧問、議員候選人發言人",風傳媒,2024-09-09,https://www.storm.mg/article/5234326,https://d1pxdrw6gckt4w.cloudfront.net/wordcloud/f6deefb9-fd38-48d2-bb85-3f63adb4f2fe,https://d1pxdrw6gckt4w.cloudfront.net/network/8161a9a0-7ae6-4c40-aa83-73f242fd1151,賴政府強化台灣原住民偏鄉地區英語教育的重要性及必要性，文章指出這些地區面臨高師資流動率和教學資源不足的挑戰，導致學生學力落差逐漸擴大。根據國家政策研究基金的報告，112學年度偏鄉學生會考英語科「待加強」的比率高達55.2％。賴清德總統曾提出AI補位「多一個助教、多一個老師」的政策，但其落實情況尚不明確。偏鄉學生難以獲得持續性的教育支持與關懷，影響其學習效果。文章建議政府應制定長期教育政策，專門針對偏鄉地區，並鼓勵社會各界參與改善工作。此外，應推動遠距教學和師資培訓計畫，讓偏鄉學生享受優質教育資源。同時，應加強偏鄉父母的親職教育。文章也提到透過遠距直播教英語等政策，提升原住民學生的「體育專業英文」能力，幫助其開展職業生涯，實現教育公平。賴政府應重視並落實這些政策，為台灣偏鄉及原住民學生創造更好的教育環境。
評論 風書房 藝文 歷史,「斧聲燭影」其實是假的：《大宋官家現形記》選摘（2）,「斧聲燭影」是討論宋太宗繼位繞不開的話題，但這個故事本身是虛假的。宋太宗如何繼位，官方史書一字未題。「斧聲燭影」出自宋人筆記《湘山野錄》，作者文瑩是位僧人，生活在宋仁宗時期，當時趙匡胤去世已七、八十年，文瑩的資訊只可能來自傳聞。《湘山野錄》記載，趙匡胤去世前一天晚上，天氣本來十分晴好，星光燦爛，趙匡胤心情十分愉快。突然之間天地陡變，雪雹驟降，讓宋太祖非常緊張，他緊急傳召皇弟趙光義入宮。趙光義進宮後，趙匡胤將他請進寢宮「酌酒對飲」。奇怪的是，趙匡胤讓伺候的宦官、宮女全部離開寢宮，只剩下皇帝與晉王兄弟倆。接下來《湘山野錄》以屋外宦官、宮女的視角描述當時的情形：但遙見燭影下，太宗時或避席，有不可勝之狀。遠遠只見屋內燭影下皇弟趙光義做出避讓樣子，好像有甚無法承受之重，這個情節就是「燭影」說法的來歷。喝至半夜三更，宮殿外雪積數寸，趙匡胤趁醉隨手拿取桌子柱斧到屋外戳雪，柱斧不是武器或工具，而是諧音「祝福」的擺飾類工藝品，所謂「斧聲」是指柱斧戳雪發出的聲音。趙匡胤一邊戳雪一邊對趙光義說：好做好做。（相關報導：風評：前有陳菊後有姚立明─兒戲國家名器，賴清德超扁趕英｜更多文章）「好做」應是「好好幹」，暗含「你辦事我放心」的意思，但也可理解為「好自為之」；按太宗毒殺太祖的觀點，「好做」也可理解為「你幹的好事」。太祖醉後酣睡，鼾聲如雷。《湘山野錄》又記載，這晚趙光義留宿宮內。凌晨太祖鼾聲突然消失，左右湊近一看太祖已駕崩，趙光義便接受遺詔繼位了。太宗留宿宮中的情節幾乎不可能出現，但後人還是依據這段所謂「斧聲燭影」的記載形成了諸多猜測。因有兄弟倆喝酒的情節，猜測趙光義酒中下毒害死趙匡胤；因出現柱斧戳雪的情節，猜測太祖被斧頭砍殺；又或者趙匡胤酒後打鼾，便推斷死於腦溢血。但「斧聲燭影」情節在《湘山野錄》中並非整篇敘述的重點，只是這部分情節被李燾摘入《續資治通鑑長編》正文，史家又過度迷信《續資治通鑑長編》，所以便圍繞著這個情節打轉。那麼《湘山野錄》敘述的重點在哪裡，這段故事從趙匡胤觀察天氣開始講起，但在此之前《湘山野錄》還有很長一段敘述也被《續資治通鑑長編》做為補充資料保留在注文中，可能因涉及道教神怪而長期為史家忽視。這部分內容是趙匡胤觀察天氣並請趙光義喝酒的起因，也是探究趙匡胤死因的重要線索：祖宗潛耀日，嘗與一道士游於關河，無定姓名，自曰「混沌」，或又曰「真無」。每有乏則探囊金，愈探愈出。三人者每劇飲爛醉。生善歌步虛為戲，能引其喉於杳冥間作清徵之聲，時或一二句，隨天風飄下，惟祖宗聞之，曰：「金猴虎頭四，真龍得真位。」至醒詰之，則曰：「醉夢語，豈足憑耶？」至膺圖受禪之日，乃庚申正月初四也。自御極不再見，下詔草澤遍訪之，或見於轘轅道中，或嵩、洛間。後十六載，乃開寶乙亥歲也，上巳祓禊，駕幸西沼，生醉坐於岸木陰下，笑揖太祖曰：「別來喜安。」上大喜，亟遣中人密引至後掖，恐其遁，急回蹕與見之，一如平時，抵掌浩飲。上謂生曰：「我久欲見汝決克一事，無他，我壽還得幾多在？」生曰：「但今年十月廿日夜，晴，則可延一紀；不爾，則當速措置。」上酷留之，俾泊後苑。苑吏或見宿於木末鳥巢中，止數日不見。帝切切記其語。,風傳媒,2024-09-09,https://www.storm.mg/article/5233717,https://d1pxdrw6gckt4w.cloudfront.net/wordcloud/3b6b185c-b4bb-4391-88e5-ef94b863f33e,https://d1pxdrw6gckt4w.cloudfront.net/network/3aeaa139-1a5d-48e8-b357-3cc37b7972a0,「斧聲燭影」這個故事是關於宋太宗繼位的傳說，然而其實這個故事是虛構的。它源自宋人筆記《湘山野錄》，記載趙匡胤去世前夜的異象和與弟弟趙光義的互動，並描繪了趙光義在趙匡胤駕崩後繼位的情景。筆記中提到趙匡胤醉酒後戳雪的聲音和燭影下趙光義的行動，這些情節被後人誤解為「斧聲燭影」的證據，進而引發了諸多猜測，如趙光義毒殺或斧砍趙匡胤。然而，這些情節並非《湘山野錄》的重點，只是被後人過度解讀。實際上，書中還記載了一段涉及道教神怪和趙匡胤觀察天氣的內容，這些可能才是探究趙匡胤死因的重要線索。
社會,8分鐘灌700cc調酒下肚！25歲工程師陳屍百貨公司廁所 初判死因出爐,"一名25歲竹科工程師，昨天上午7點多被巡邏保全發現，陳屍台北市信義區松壽路的ATT 4 Fun的廁所，警方從監視器發現他前一晚多次進出廁所嘔吐，今天相驗後真相大白，原來竟是他在七日晚間參加酒吧的調酒比賽，8分鐘內狂700cc伏特加混合「斷魂百香果」調酒，死亡原因推測：急性酒精中毒或是嘔吐物阻塞氣管，但得經法醫解剖才知真正死因。

保全員是在8日上午7時17分巡邏百貨公司，發現B2男廁有25歲張姓男子坐在馬桶上沒有回應，隨即通報119到場，警消發現他無呼吸心跳，明顯死亡。

警方調閱附近監視器畫面發現，張姓男子前一晚曾在附近酒吧飲酒，並參加酒吧所舉辦的調酒比賽，他在8分鐘內喝了700cc的伏特加加百香果調酒，接著就到店內洗手間上廁所，數分鐘後內多次進出廁所，之後就沒有離開。

檢方相驗初判，男子疑似急性酒精中毒，或是酒醉嘔吐引發氣管梗塞致死，但要再剖檢遺體才能釐清。


※提醒您：禁止酒駕 飲酒過量有礙健康

",聯合新聞網,2024-09-09,https://udn.com/news/story/7320/8216042,https://d1pxdrw6gckt4w.cloudfront.net/wordcloud/bfd0279b-ef36-4e79-8c23-977cf019f228,https://d1pxdrw6gckt4w.cloudfront.net/network/ab79df62-589b-443a-929d-24d218b8240f,一名25歲竹科工程師在台北市信義區ATT 4 Fun的廁所被發現陳屍，警方調查顯示他在參加調酒比賽時，在8分鐘內狂飲700cc伏特加混合百香果調酒，隨後多次進出廁所嘔吐。保全員在次日早上發現他坐在馬桶上無反應，通報119到場後確認他已無呼吸心跳。檢方初步判定死因疑似急性酒精中毒或嘔吐物阻塞氣管，但需經法醫解剖後才能確定。這起事件提醒人們飲酒過量有礙健康，並強調禁止酒駕。
要聞,京華城案羈押禁見 律師團今聲明：柯文哲不抗告了！,"

民眾黨主席、前台北市長柯文哲涉京華城等弊案，本月5日由台北地院裁定羈押禁見，柯的律師團律師鄭深元、陸正義、蕭奕弘3人今天發表聯合聲明，表示柯文哲已決定不就羈押禁見裁定提起抗告。

刑事訴訟程序法定提抗告應在裁定出爐後10天之內為之，以柯文哲羈押處分發生時間在本月5日來說，最後抗告期限是本月15日，不過，15日適逢周休應順延1日，柯如要抗告，至遲須在本月16日以前提出。

柯文哲的律師團今天發表聯合聲明表示，「柯文哲先生於庭前即已向辯護人明白表示：其曾向庭上陳明不願讓法院有所為難，且如遭羈押，不願抗告，請檢察官於此二個月之羈押期間內，窮盡一切調查義務，本人亦會盡力配合調查」。

聲明表示「後經辯護人律見時再次確認，柯文哲先生仍然表示不願提起抗告。因抗告之提起與否，辯護人依法不得違反委任人明示之意思，故基尊重當事人之意願，不再抗告」。",聯合新聞網,2024-09-09,https://udn.com/news/story/124199/8215857,https://d1pxdrw6gckt4w.cloudfront.net/wordcloud/3641c487-2cd1-4334-aec7-a489ed2e80e2,https://d1pxdrw6gckt4w.cloudfront.net/network/7cc13f0e-5c47-4bfc-bf8a-fba030eff063,民眾黨主席、前台北市長柯文哲因涉京華城等弊案，本月5日被台北地院裁定羈押禁見。柯文哲的律師團今天發表聯合聲明，表示柯文哲已決定不對羈押禁見裁定提起抗告。根據刑事訴訟程序法，抗告應在裁定出爐後10天內提出，最後期限為本月16日。柯文哲在庭前已向辯護人表示，不願讓法院為難，如遭羈押，不願抗告，並會配合調查。律師團表示經再次確認後，柯文哲仍堅持不抗告，因抗告與否需尊重當事人意願，律師團決定不再抗告。
兩岸,華郵：秦剛還活著 但被貶黜到出版社低階職務,"華盛頓郵報(Washington Post)8日報導，根據兩名美國前官員的說法，「失蹤」的中國前外交部長秦剛還活著，但地位今非昔比，他被分配到一家中國外交部下屬的出版社，擔任低階職務。

美國前官員說，58歲的秦剛被安排到外交部隸下的國有出版社「世界知識出版社」工作。

兩名前官員稱這次降職發生在春季，其中一名官員透露，雖然這意味著秦剛「失寵」，但也表示他已脫離險境：「他不會進監獄，但他的職業生涯已經結束了。」

前中央情報局中國資深分析師、現任諮詢公司中國策略集團負責人強森(Christopher K. Johnson)表示，秦剛的迅速崛起惹惱了同事。

身為中國國家主席習近平的忠實擁護者，秦剛以創紀錄的速度被晉升為外交部長。 56歲時，他不僅被任命為部長，還被升任為國務委員；這是秦剛的前任王毅在擔任外交部長五年後，在65歲時才獲得的職位。

秦剛在2023年夏天從公眾視野中神秘消失，中國外交部一再拒絕回應外界對秦剛去向的詢問；盛傳他與中國電視主持人傅曉田有婚外情，兩人在美國生下了一個非婚生孩子，但此事未獲得證實。



",聯合新聞網,2024-09-09,https://udn.com/news/story/7331/8215278,https://d1pxdrw6gckt4w.cloudfront.net/wordcloud/54932180-7c56-4d74-b2ad-5bd32ec16c00,https://d1pxdrw6gckt4w.cloudfront.net/network/f9b546a5-6bb5-4794-8fad-8c9bc7e50cd3,華盛頓郵報報導，失蹤的前中國外交部長秦剛仍然健在，但地位大不如前，現被安排到外交部下屬的「世界知識出版社」擔任低階職務。據美國前官員透露，這次降職發生在春季，儘管意味著秦剛失寵，但他已脫離險境，不會進監獄，但職業生涯已結束。前中央情報局中國資深分析師強森指出，秦剛的迅速升遷引起同事不滿。秦剛曾是習近平的忠實擁護者，以創紀錄的速度晉升為外交部長和國務委員。然而，秦剛於2023年夏天神秘消失，傳聞他與中國電視主持人傅曉田有婚外情並育有一子，但未獲證實。
生活,8分鐘灌1公升烈酒！25歲工程師廁所猝死 醫師詳解恐怖死因,"

一名25歲張姓工程師與友人相約台北市信義區的酒吧，興致一來，挑戰8分鐘喝1公升調酒的比賽。隨後身體不適，步行至200百公尺的ATT 4 Fun，昨（8）日上午被發現陳屍在廁所內，警方初步調查，這名男子疑飲酒過量致死。

短時間內喝下以酒精濃度40%伏特加為基底的水果調酒，再加上一公升的巨量，台北市立聯合醫院松德院區成癮防治科醫師何逸群表示，這樣喝真的會出事！拚酒比賽會讓酒精快速跑進腦部，可能會抑制呼吸、心跳，造成猝死。

據警方調查，張男當晚與一群人在信義區百貨商圈的戶外酒吧飲酒，自願參加「1公升的眼淚」促銷活動，喝下1公升調酒，後來自行兩度進出200公尺外的廁所，最後倒在馬桶身亡。家屬表示，張男生前沒有重大疾病，平常因工作關係往返台北、新竹。

何逸群說，酒精濃度過高，對於大腦的作用影響也更多，包括引起精神方面的障礙。酒精若超過一定的濃度，就成了一種中樞神經抑制劑，會阻斷神經元的傳導，讓人失去控制能力，包括自言自語、步伐不穩、惡心想吐等。

隨著血液中的酒精濃度變高，腦神經系的機能也受到抑制，五感慢慢麻痺，開始進入急性酒精中毒的狀態。何逸群提到，民眾酒後嘔吐，可能會遭嘔吐物噎住呼吸道，窒息而死；也可能因步伐不穩，走路跌到撞到頭昏迷，甚至死亡。

暴飲酒真的會「喝死人 」，何逸群提醒，國健署提供「酒精單位」讓民眾參考自己評估安全範圍、試算喝的酒是否過量。以這位張姓工程師喝的一公升烈酒來說，等於是33個單位，超標且爆量，已經有致死的風險。

台安醫院急診科主任韓昌旺表示，酒喝多喝少，都有可能出現酒精中毒，尤其是短時間喝下大量的酒，影響大腦運轉、抑制呼吸及心跳。他提醒，不可放讓酒醉者昏睡，因為有可能會被自己的嘔吐物塞住呼吸道而窒息，或嗆咳進肺裡面造成吸入性肺炎。

有些民眾喝醉之後，趴著熟睡或臉部被枕頭悶住，完全無法自行移開，最後被異物悶死。韓昌旺強調，喝醉酒會讓全身肌肉鬆弛癱軟，沒有足夠的支撐力變化睡姿，身體吸入空氣量不足，加重醉後昏迷，可能引發休克。
  ※ 提醒您：禁止酒駕 飲酒過量有礙健康  
",聯合新聞網,2024-09-09,https://udn.com/news/story/7266/8216721,https://d1pxdrw6gckt4w.cloudfront.net/wordcloud/d59c3d18-b967-4896-a932-3441ddd753bf,https://d1pxdrw6gckt4w.cloudfront.net/network/d6627bdb-c117-4d69-bc10-186985286540,一名25歲的張姓工程師在台北市信義區的酒吧參加8分鐘內喝1公升調酒的比賽後，因飲酒過量在ATT 4 Fun的廁所內猝死。台北市立聯合醫院松德院區成癮防治科醫師何逸群表示，短時間內喝下高濃度酒精的調酒會迅速影響大腦，抑制呼吸和心跳，可能導致猝死。家屬表示張男生前無重大疾病。專家指出，急性酒精中毒會抑制中樞神經，導致失去控制能力和五感麻痺，酒後嘔吐可能引發窒息或步伐不穩導致致命的跌倒。國健署建議民眾應評估飲酒量避免過量，急診科主任韓昌旺強調短時間內大量飲酒會導致酒精中毒，提醒不可讓酒醉者昏睡以免窒息或肺炎。
